{
  "scraped_at": "2026-01-05T09:22:47.317575",
  "source": "Goodwill Central Texas - Career Advancement Training Wufoo Forms",
  "total_classes": 23,
  "classes": [
    {
      "class_name": "Budgeting Basics",
      "location": "GRC",
      "location_full": "Goodwill Resource Center (South Austin)",
      "form_url": "https://gwcareeradvancement.wufoo.com/forms/grc-budgeting-basics/",
      "sessions": [
        {
          "date": null,
          "date_display": "Select from Dropdown\n\t\t\t\t\t\t\t\t\t -- 0 remaining",
          "time_start": null,
          "time_end": null,
          "time_display": null,
          "instructor": null,
          "spots_remaining": 0,
          "is_full": true,
          "is_past": false,
          "raw_text": "Select from Dropdown\n\t\t\t\t\t\t\t\t\t -- 0 remaining"
        },
        {
          "date": "2025-12-29",
          "date_display": "12/29/2025",
          "time_start": "09:00",
          "time_end": "11:00",
          "time_display": "9:00-11:00",
          "instructor": "Cindy",
          "spots_remaining": 4,
          "is_full": false,
          "is_past": true,
          "raw_text": "12/29/2025, 9:00-11:00; Cindy\n\t\t\t\t\t\t\t\t\t -- 4 remaining"
        },
        {
          "date": "2025-12-30",
          "date_display": "12/30/2025",
          "time_start": "11:00",
          "time_end": "01:00",
          "time_display": "11:00-1:00",
          "instructor": "Cindy",
          "spots_remaining": 3,
          "is_full": false,
          "is_past": true,
          "raw_text": "12/30/2025, 11:00-1:00; Cindy\n\t\t\t\t\t\t\t\t\t -- 3 remaining"
        },
        {
          "date": "2025-12-31",
          "date_display": "12/31/2025",
          "time_start": "11:00",
          "time_end": "01:00",
          "time_display": "11:00-1:00",
          "instructor": "Cindy",
          "spots_remaining": 4,
          "is_full": false,
          "is_past": true,
          "raw_text": "12/31/2025, 11:00-1:00; Cindy\n\t\t\t\t\t\t\t\t\t -- 4 remaining"
        },
        {
          "date": "2026-01-05",
          "date_display": "01/05/2026",
          "time_start": "09:00",
          "time_end": "11:00",
          "time_display": "9:00-11:00",
          "instructor": "Cindy",
          "spots_remaining": 4,
          "is_full": false,
          "is_past": true,
          "raw_text": "01/05/2026, 9:00-11:00; Cindy\n\t\t\t\t\t\t\t\t\t -- 4 remaining"
        },
        {
          "date": "2026-01-06",
          "date_display": "01/06/2026",
          "time_start": "01:30",
          "time_end": "03:30",
          "time_display": "1:30-3:30",
          "instructor": "Cindy",
          "spots_remaining": 4,
          "is_full": false,
          "is_past": false,
          "raw_text": "01/06/2026, 1:30-3:30; Cindy\n\t\t\t\t\t\t\t\t\t -- 4 remaining"
        },
        {
          "date": "2026-01-07",
          "date_display": "01/07/2026",
          "time_start": "10:00",
          "time_end": "12:00",
          "time_display": "10:00-12:00",
          "instructor": "Cindy",
          "spots_remaining": 4,
          "is_full": false,
          "is_past": false,
          "raw_text": "01/07/2026, 10:00-12:00; Cindy\n\t\t\t\t\t\t\t\t\t -- 4 remaining"
        },
        {
          "date": "2026-01-09",
          "date_display": "01/09/2026",
          "time_start": "01:00",
          "time_end": "03:00",
          "time_display": "1:00-3:00",
          "instructor": "Cindy",
          "spots_remaining": 4,
          "is_full": false,
          "is_past": false,
          "raw_text": "01/09/2026, 1:00-3:00; Cindy\n\t\t\t\t\t\t\t\t\t -- 4 remaining"
        },
        {
          "date": "2026-01-12",
          "date_display": "01/12/2026",
          "time_start": "10:00",
          "time_end": "12:00",
          "time_display": "10:00-12:00",
          "instructor": "Cindy",
          "spots_remaining": 4,
          "is_full": false,
          "is_past": false,
          "raw_text": "01/12/2026, 10:00-12:00; Cindy\n\t\t\t\t\t\t\t\t\t -- 4 remaining"
        },
        {
          "date": "2026-01-14",
          "date_display": "01/14/2026",
          "time_start": "01:30",
          "time_end": "03:30",
          "time_display": "1:30-3:30",
          "instructor": "Cindy",
          "spots_remaining": 4,
          "is_full": false,
          "is_past": false,
          "raw_text": "01/14/2026, 1:30-3:30; Cindy\n\t\t\t\t\t\t\t\t\t -- 4 remaining"
        },
        {
          "date": "2026-01-20",
          "date_display": "01/20/2026",
          "time_start": "09:00",
          "time_end": "11:00",
          "time_display": "9:00-11:00",
          "instructor": "Cindy",
          "spots_remaining": 4,
          "is_full": false,
          "is_past": false,
          "raw_text": "01/20/2026, 9:00-11:00; Cindy\n\t\t\t\t\t\t\t\t\t -- 4 remaining"
        },
        {
          "date": "2026-01-21",
          "date_display": "01/21/2026",
          "time_start": "02:00",
          "time_end": "04:00",
          "time_display": "2:00-4:00",
          "instructor": "Cindy",
          "spots_remaining": 4,
          "is_full": false,
          "is_past": false,
          "raw_text": "01/21/2026, 2:00-4:00; Cindy\n\t\t\t\t\t\t\t\t\t -- 4 remaining"
        },
        {
          "date": "2026-01-22",
          "date_display": "01/22/2026",
          "time_start": "10:00",
          "time_end": "12:00",
          "time_display": "10:00-12:00",
          "instructor": "Cindy",
          "spots_remaining": 4,
          "is_full": false,
          "is_past": false,
          "raw_text": "01/22/2026, 10:00-12:00; Cindy\n\t\t\t\t\t\t\t\t\t -- 4 remaining"
        },
        {
          "date": "2026-01-26",
          "date_display": "01/26/2026",
          "time_start": "02:00",
          "time_end": "04:00",
          "time_display": "2:00-4:00",
          "instructor": "Cindy",
          "spots_remaining": 4,
          "is_full": false,
          "is_past": false,
          "raw_text": "01/26/2026, 2:00-4:00; Cindy\n\t\t\t\t\t\t\t\t\t -- 4 remaining"
        },
        {
          "date": "2026-01-27",
          "date_display": "01/27/2026",
          "time_start": "01:00",
          "time_end": "03:00",
          "time_display": "1:00-3:00",
          "instructor": "Cindy",
          "spots_remaining": 4,
          "is_full": false,
          "is_past": false,
          "raw_text": "01/27/2026, 1:00-3:00; Cindy\n\t\t\t\t\t\t\t\t\t -- 4 remaining"
        },
        {
          "date": "2026-01-29",
          "date_display": "01/29/2026",
          "time_start": "10:00",
          "time_end": "12:00",
          "time_display": "10:00-12:00",
          "instructor": "Cindy",
          "spots_remaining": 4,
          "is_full": false,
          "is_past": false,
          "raw_text": "01/29/2026, 10:00-12:00; Cindy\n\t\t\t\t\t\t\t\t\t -- 4 remaining"
        }
      ],
      "last_updated": "2026-01-05T09:21:30.730347"
    },
    {
      "class_name": "Career Advancement Essentials",
      "location": "GRC",
      "location_full": "Goodwill Resource Center (South Austin)",
      "form_url": "https://gwcareeradvancement.wufoo.com/forms/grc-career-advancement-essentials/",
      "sessions": [
        {
          "date": null,
          "date_display": "Select from Dropdown\n\t\t\t\t\t\t\t\t\t -- 0 remaining",
          "time_start": null,
          "time_end": null,
          "time_display": null,
          "instructor": null,
          "spots_remaining": 0,
          "is_full": true,
          "is_past": false,
          "raw_text": "Select from Dropdown\n\t\t\t\t\t\t\t\t\t -- 0 remaining"
        },
        {
          "date": "2025-11-10",
          "date_display": "November 10-14",
          "time_start": "09:00",
          "time_end": "12:00",
          "time_display": "9:00am-12:00pm",
          "instructor": "Mary",
          "spots_remaining": 0,
          "is_full": true,
          "is_past": true,
          "raw_text": "November 10-14, 9:00-12:00 pm, Mary\n\t\t\t\t\t\t\t\t\t -- 0 remaining"
        },
        {
          "date": "2025-12-08",
          "date_display": "December 8-11",
          "time_start": "09:00",
          "time_end": "12:00",
          "time_display": "9:00am-12:00pm",
          "instructor": "Mary",
          "spots_remaining": 0,
          "is_full": true,
          "is_past": true,
          "raw_text": "December 8-11, 9:00am-12:00pm; Mary\n\t\t\t\t\t\t\t\t\t -- 0 remaining"
        },
        {
          "date": "2026-01-12",
          "date_display": "January 12-16",
          "time_start": "09:00",
          "time_end": "12:00",
          "time_display": "9:00am-12:00pm",
          "instructor": "Mary",
          "spots_remaining": 5,
          "is_full": false,
          "is_past": false,
          "raw_text": "January 12-16, 9:00am-12:00pm, Mary\n\t\t\t\t\t\t\t\t\t -- 5 remaining"
        }
      ],
      "last_updated": "2026-01-05T09:21:34.004662"
    },
    {
      "class_name": "Computer Basics/Keyboarding",
      "location": "GRC",
      "location_full": "Goodwill Resource Center (South Austin)",
      "form_url": "https://gwcareeradvancement.wufoo.com/forms/grc-computer-basics/",
      "sessions": [
        {
          "date": null,
          "date_display": "Select from Dropdown\n\t\t\t\t\t\t\t\t\t -- 0 remaining",
          "time_start": null,
          "time_end": null,
          "time_display": null,
          "instructor": null,
          "spots_remaining": 0,
          "is_full": true,
          "is_past": false,
          "raw_text": "Select from Dropdown\n\t\t\t\t\t\t\t\t\t -- 0 remaining"
        },
        {
          "date": "2025-09-03",
          "date_display": "09/03/2025",
          "time_start": "13:30",
          "time_end": "15:30",
          "time_display": "1:30pm-3:30pm",
          "instructor": "Mary",
          "spots_remaining": 4,
          "is_full": false,
          "is_past": true,
          "raw_text": "09/03/25, 1:30-3:30 pm, Mary\n\t\t\t\t\t\t\t\t\t -- 4 remaining"
        }
      ],
      "last_updated": "2026-01-05T09:21:37.595003"
    },
    {
      "class_name": "Credit Basics",
      "location": "GRC",
      "location_full": "Goodwill Resource Center (South Austin)",
      "form_url": "https://gwcareeradvancement.wufoo.com/forms/z19v5buf0f0tvm2/",
      "sessions": [
        {
          "date": null,
          "date_display": "Select from Dropdown\n\t\t\t\t\t\t\t\t\t -- 0 remaining",
          "time_start": null,
          "time_end": null,
          "time_display": null,
          "instructor": null,
          "spots_remaining": 0,
          "is_full": true,
          "is_past": false,
          "raw_text": "Select from Dropdown\n\t\t\t\t\t\t\t\t\t -- 0 remaining"
        },
        {
          "date": "2026-01-08",
          "date_display": "01/08/2026",
          "time_start": null,
          "time_end": null,
          "time_display": null,
          "instructor": "Doug",
          "spots_remaining": 0,
          "is_full": true,
          "is_past": false,
          "raw_text": "01/08/2026, 10:00-Noon, Doug\n\t\t\t\t\t\t\t\t\t -- 0 remaining"
        },
        {
          "date": "2026-01-14",
          "date_display": "01/14/2026",
          "time_start": "09:00",
          "time_end": "11:00",
          "time_display": "9:00am-11:00am",
          "instructor": "Doug",
          "spots_remaining": 4,
          "is_full": false,
          "is_past": false,
          "raw_text": "01/14/2026, 9:00-11:00am, Doug\n\t\t\t\t\t\t\t\t\t -- 4 remaining"
        },
        {
          "date": "2026-01-22",
          "date_display": "01/22/2026",
          "time_start": "13:00",
          "time_end": "15:00",
          "time_display": "1:00pm-3:00pm",
          "instructor": "Doug",
          "spots_remaining": 4,
          "is_full": false,
          "is_past": false,
          "raw_text": "01/22/2026, 1:00-3:00pm, Doug\n\t\t\t\t\t\t\t\t\t -- 4 remaining"
        },
        {
          "date": "2026-01-27",
          "date_display": "01/27/2026",
          "time_start": "13:00",
          "time_end": "15:00",
          "time_display": "1:00pm-3:00pm",
          "instructor": "Doug",
          "spots_remaining": 4,
          "is_full": false,
          "is_past": false,
          "raw_text": "01/27/2026, 1:00-3:00pm, Doug\n\t\t\t\t\t\t\t\t\t -- 4 remaining"
        },
        {
          "date": "2026-01-29",
          "date_display": "01/29/2026",
          "time_start": "09:30",
          "time_end": "11:30",
          "time_display": "9:30-11:30",
          "instructor": "Doug",
          "spots_remaining": 4,
          "is_full": false,
          "is_past": false,
          "raw_text": "01/29/2026, 9:30-11:30, Doug\n\t\t\t\t\t\t\t\t\t -- 4 remaining"
        }
      ],
      "last_updated": "2026-01-05T09:21:40.917951"
    },
    {
      "class_name": "Digital Skills 1:1",
      "location": "GRC",
      "location_full": "Goodwill Resource Center (South Austin)",
      "form_url": "https://gwcareeradvancement.wufoo.com/forms/grc-digital-skills-11/",
      "sessions": [
        {
          "date": null,
          "date_display": "Select from Dropdown\n\t\t\t\t\t\t\t\t\t -- 0 remaining",
          "time_start": null,
          "time_end": null,
          "time_display": null,
          "instructor": null,
          "spots_remaining": 0,
          "is_full": true,
          "is_past": false,
          "raw_text": "Select from Dropdown\n\t\t\t\t\t\t\t\t\t -- 0 remaining"
        },
        {
          "date": "2026-01-02",
          "date_display": "01/02/2026",
          "time_start": "09:30",
          "time_end": "10:30",
          "time_display": "9:30am-10:30am",
          "instructor": "Mary",
          "spots_remaining": 1,
          "is_full": false,
          "is_past": true,
          "raw_text": "1/2/2026, 9:30am-10:30am; Mary\n\t\t\t\t\t\t\t\t\t -- 1 remaining"
        },
        {
          "date": "2026-01-06",
          "date_display": "01/06/2026",
          "time_start": "15:00",
          "time_end": "16:00",
          "time_display": "3:00pm-4:00pm",
          "instructor": "Mary",
          "spots_remaining": 1,
          "is_full": false,
          "is_past": false,
          "raw_text": "1/6/2026, 3:00pm-4:00pm; Mary\n\t\t\t\t\t\t\t\t\t -- 1 remaining"
        },
        {
          "date": "2026-01-07",
          "date_display": "01/07/2026",
          "time_start": "10:00",
          "time_end": "11:00",
          "time_display": "10:00am-11:00am",
          "instructor": "Mary",
          "spots_remaining": 1,
          "is_full": false,
          "is_past": false,
          "raw_text": "1/7/2026, 10:00am-11:00am; Mary\n\t\t\t\t\t\t\t\t\t -- 1 remaining"
        },
        {
          "date": "2026-01-08",
          "date_display": "01/08/2026",
          "time_start": "09:00",
          "time_end": "10:00",
          "time_display": "9:00am-10:00am",
          "instructor": "Mary",
          "spots_remaining": 1,
          "is_full": false,
          "is_past": false,
          "raw_text": "1/8/2026, 9:00am-10:00am; Mary\n\t\t\t\t\t\t\t\t\t -- 1 remaining"
        },
        {
          "date": "2026-01-09",
          "date_display": "01/09/2026",
          "time_start": "13:00",
          "time_end": "14:00",
          "time_display": "1:00pm-2:00pm",
          "instructor": "Mary",
          "spots_remaining": 1,
          "is_full": false,
          "is_past": false,
          "raw_text": "1/9/2026, 1:00pm-2:00pm; Mary\n\t\t\t\t\t\t\t\t\t -- 1 remaining"
        },
        {
          "date": "2026-01-10",
          "date_display": "01/10/2026",
          "time_start": "13:00",
          "time_end": "14:00",
          "time_display": "1:00pm-2:00pm",
          "instructor": "Mary",
          "spots_remaining": 1,
          "is_full": false,
          "is_past": false,
          "raw_text": "1/10/2026, 1:00pm-2:00pm; Mary\n\t\t\t\t\t\t\t\t\t -- 1 remaining"
        },
        {
          "date": "2026-01-14",
          "date_display": "01/14/2026",
          "time_start": "14:30",
          "time_end": "15:30",
          "time_display": "2:30pm-3:30pm",
          "instructor": "Mary",
          "spots_remaining": 1,
          "is_full": false,
          "is_past": false,
          "raw_text": "1/14/2026, 2:30pm-3:30pm; Mary\n\t\t\t\t\t\t\t\t\t -- 1 remaining"
        },
        {
          "date": "2026-01-16",
          "date_display": "01/16/2026",
          "time_start": "14:30",
          "time_end": "15:30",
          "time_display": "2:30pm-3:30pm",
          "instructor": "Mary",
          "spots_remaining": 1,
          "is_full": false,
          "is_past": false,
          "raw_text": "1/16/26, 2:30pm–3:30pm, Mary\n\t\t\t\t\t\t\t\t\t -- 1 remaining"
        },
        {
          "date": "2026-01-20",
          "date_display": "01/20/2026",
          "time_start": "15:00",
          "time_end": "16:00",
          "time_display": "3:00pm-4:00pm",
          "instructor": "Mary",
          "spots_remaining": 1,
          "is_full": false,
          "is_past": false,
          "raw_text": "1/20/26, 3:00pm–4:00pm, Mary\n\t\t\t\t\t\t\t\t\t -- 1 remaining"
        },
        {
          "date": "2026-01-21",
          "date_display": "01/21/2026",
          "time_start": "12:30",
          "time_end": "13:30",
          "time_display": "12:30pm-1:30pm",
          "instructor": "Cindy",
          "spots_remaining": 1,
          "is_full": false,
          "is_past": false,
          "raw_text": "01/21/2026, 12:30pm-1:30pm; Cindy\n\t\t\t\t\t\t\t\t\t -- 1 remaining"
        },
        {
          "date": "2026-01-22",
          "date_display": "01/22/2026",
          "time_start": "14:00",
          "time_end": "14:00",
          "time_display": "2:00pm-2:00pm",
          "instructor": "Mary",
          "spots_remaining": 1,
          "is_full": false,
          "is_past": false,
          "raw_text": "1/22/26, 2:00pm–2:00pm, Mary\n\t\t\t\t\t\t\t\t\t -- 1 remaining"
        },
        {
          "date": "2026-01-26",
          "date_display": "01/26/2026",
          "time_start": "12:30",
          "time_end": "13:30",
          "time_display": "12:30pm-1:30pm",
          "instructor": "Cindy",
          "spots_remaining": 1,
          "is_full": false,
          "is_past": false,
          "raw_text": "01/26/2026, 12:30pm-1:30pm; Cindy\n\t\t\t\t\t\t\t\t\t -- 1 remaining"
        },
        {
          "date": "2026-01-27",
          "date_display": "01/27/2026",
          "time_start": "09:00",
          "time_end": "10:00",
          "time_display": "9:00am-10:00am",
          "instructor": "Mary",
          "spots_remaining": 1,
          "is_full": false,
          "is_past": false,
          "raw_text": "1/27/26,9:00am–10:00am, Mary\n\t\t\t\t\t\t\t\t\t -- 1 remaining"
        },
        {
          "date": "2026-01-27",
          "date_display": "01/27/2026",
          "time_start": "15:00",
          "time_end": "16:00",
          "time_display": "3:00pm-4:00pm",
          "instructor": "Mary",
          "spots_remaining": 1,
          "is_full": false,
          "is_past": false,
          "raw_text": "1/27/26, 3:00pm–4:00pm, Mary\n\t\t\t\t\t\t\t\t\t -- 1 remaining"
        },
        {
          "date": "2026-01-28",
          "date_display": "01/28/2026",
          "time_start": "14:00",
          "time_end": "15:00",
          "time_display": "2:00pm-3:00pm",
          "instructor": "Mary",
          "spots_remaining": 1,
          "is_full": false,
          "is_past": false,
          "raw_text": "1/28/26, 2:00pm–3:00pm, Mary\n\t\t\t\t\t\t\t\t\t -- 1 remaining"
        },
        {
          "date": "2026-01-29",
          "date_display": "01/29/2026",
          "time_start": "13:30",
          "time_end": "14:30",
          "time_display": "1:30pm-2:30pm",
          "instructor": "Mary",
          "spots_remaining": 1,
          "is_full": false,
          "is_past": false,
          "raw_text": "1/29/26, 1:30pm–2:30pm, Mary\n\t\t\t\t\t\t\t\t\t -- 1 remaining"
        },
        {
          "date": "2026-01-30",
          "date_display": "01/30/2026",
          "time_start": "09:00",
          "time_end": "10:00",
          "time_display": "9:00am-10:00am",
          "instructor": "Mary",
          "spots_remaining": 1,
          "is_full": false,
          "is_past": false,
          "raw_text": "1/30/26, 9:00am–10:00am, Mary\n\t\t\t\t\t\t\t\t\t -- 1 remaining"
        },
        {
          "date": null,
          "date_display": "1/023026",
          "time_start": "13:30",
          "time_end": "14:30",
          "time_display": "1:30pm-2:30pm",
          "instructor": "Mary",
          "spots_remaining": 1,
          "is_full": false,
          "is_past": false,
          "raw_text": "1/023026, 1:30pm–2:30pm, Mary\n\t\t\t\t\t\t\t\t\t -- 1 remaining"
        }
      ],
      "last_updated": "2026-01-05T09:21:44.519739"
    },
    {
      "class_name": "Financial Empowerment Training",
      "location": "GRC",
      "location_full": "Goodwill Resource Center (South Austin)",
      "form_url": "https://gwcareeradvancement.wufoo.com/forms/grc-11-financial-empowerment-trainings/",
      "sessions": [
        {
          "date": null,
          "date_display": "Select from Dropdown\n\t\t\t\t\t\t\t\t\t -- 0 remaining",
          "time_start": null,
          "time_end": null,
          "time_display": null,
          "instructor": null,
          "spots_remaining": 0,
          "is_full": true,
          "is_past": false,
          "raw_text": "Select from Dropdown\n\t\t\t\t\t\t\t\t\t -- 0 remaining"
        },
        {
          "date": "2025-12-29",
          "date_display": "12/29/2025",
          "time_start": "12:30",
          "time_end": "13:30",
          "time_display": "12:30pm-1:30pm",
          "instructor": "Cindy",
          "spots_remaining": 0,
          "is_full": true,
          "is_past": true,
          "raw_text": "12/29/25, 12:30 pm - 1:30 pm; Cindy\n\t\t\t\t\t\t\t\t\t -- 0 remaining"
        },
        {
          "date": "2025-12-29",
          "date_display": "12/29/2025",
          "time_start": "15:00",
          "time_end": "16:00",
          "time_display": "3:00pm-4:00pm",
          "instructor": "Cindy",
          "spots_remaining": 0,
          "is_full": true,
          "is_past": true,
          "raw_text": "12/29/25, 3:00 pm - 4:00 pm; Cindy\n\t\t\t\t\t\t\t\t\t -- 0 remaining"
        },
        {
          "date": "2025-12-30",
          "date_display": "12/30/2025",
          "time_start": "13:30",
          "time_end": "14:30",
          "time_display": "1:30pm-2:30pm",
          "instructor": "Cindy",
          "spots_remaining": 1,
          "is_full": false,
          "is_past": true,
          "raw_text": "12/30/25, 1:30 pm - 2:30 pm; Cindy\n\t\t\t\t\t\t\t\t\t -- 1 remaining"
        },
        {
          "date": "2025-12-31",
          "date_display": "12/31/2025",
          "time_start": "14:00",
          "time_end": "15:00",
          "time_display": "2:00pm-3:00pm",
          "instructor": "Cindy",
          "spots_remaining": 1,
          "is_full": false,
          "is_past": true,
          "raw_text": "12/31/25, 2:00 pm - 3:00 pm; Cindy\n\t\t\t\t\t\t\t\t\t -- 1 remaining"
        },
        {
          "date": "2026-01-05",
          "date_display": "01/05/2026",
          "time_start": "13:00",
          "time_end": "14:00",
          "time_display": "1:00pm-2:00pm",
          "instructor": "Cindy",
          "spots_remaining": 1,
          "is_full": false,
          "is_past": true,
          "raw_text": "01/05/26, 1:00 pm - 2:00 pm; Cindy\n\t\t\t\t\t\t\t\t\t -- 1 remaining"
        },
        {
          "date": "2026-01-05",
          "date_display": "01/05/2026",
          "time_start": "15:00",
          "time_end": "16:00",
          "time_display": "3:00pm-4:00pm",
          "instructor": "Cindy",
          "spots_remaining": 1,
          "is_full": false,
          "is_past": true,
          "raw_text": "01/05/26, 3:00 pm - 4:00 pm; Cindy\n\t\t\t\t\t\t\t\t\t -- 1 remaining"
        },
        {
          "date": "2026-01-06",
          "date_display": "01/06/2026",
          "time_start": "09:00",
          "time_end": "10:00",
          "time_display": "9:00am-10:00am",
          "instructor": "Cindy",
          "spots_remaining": 1,
          "is_full": false,
          "is_past": false,
          "raw_text": "01/06/26, 9:00 am - 10:00 am; Cindy\n\t\t\t\t\t\t\t\t\t -- 1 remaining"
        },
        {
          "date": "2026-01-06",
          "date_display": "01/06/2026",
          "time_start": "12:30",
          "time_end": "13:30",
          "time_display": "12:30pm-1:30pm",
          "instructor": "Cindy",
          "spots_remaining": 0,
          "is_full": true,
          "is_past": false,
          "raw_text": "01/06/26,  12:30 pm - 1:30 pm; Cindy\n\t\t\t\t\t\t\t\t\t -- 0 remaining"
        },
        {
          "date": "2026-01-07",
          "date_display": "01/07/2026",
          "time_start": "09:00",
          "time_end": "10:00",
          "time_display": "9:00am-10:00am",
          "instructor": "Cindy",
          "spots_remaining": 0,
          "is_full": true,
          "is_past": false,
          "raw_text": "01/07/26, 9:00 am - 10:00 am; Cindy\n\t\t\t\t\t\t\t\t\t -- 0 remaining"
        },
        {
          "date": "2026-01-07",
          "date_display": "01/07/2026",
          "time_start": "14:00",
          "time_end": "15:00",
          "time_display": "2:00pm-3:00pm",
          "instructor": "Cindy",
          "spots_remaining": 1,
          "is_full": false,
          "is_past": false,
          "raw_text": "01/07/26, 2:00 pm - 3:00 pm; Cindy\n\t\t\t\t\t\t\t\t\t -- 1 remaining"
        },
        {
          "date": "2026-01-09",
          "date_display": "01/09/2026",
          "time_start": "11:00",
          "time_end": "12:00",
          "time_display": "11:00am-12:00pm",
          "instructor": "Cindy",
          "spots_remaining": 1,
          "is_full": false,
          "is_past": false,
          "raw_text": "01/09/26, 11:00 am - 12:00 pm; Cindy\n\t\t\t\t\t\t\t\t\t -- 1 remaining"
        },
        {
          "date": "2026-01-12",
          "date_display": "01/12/2026",
          "time_start": "09:00",
          "time_end": "10:00",
          "time_display": "9:00am-10:00am",
          "instructor": "Cindy",
          "spots_remaining": 1,
          "is_full": false,
          "is_past": false,
          "raw_text": "01/12/26, 9:00 am - 10:00 am; Cindy\n\t\t\t\t\t\t\t\t\t -- 1 remaining"
        },
        {
          "date": "2026-01-13",
          "date_display": "01/13/2026",
          "time_start": "09:00",
          "time_end": "10:00",
          "time_display": "9:00am-10:00am",
          "instructor": "Cindy",
          "spots_remaining": 1,
          "is_full": false,
          "is_past": false,
          "raw_text": "01/13/26, 9:00 am - 10:00 am; Cindy\n\t\t\t\t\t\t\t\t\t -- 1 remaining"
        },
        {
          "date": "2026-01-13",
          "date_display": "01/13/2026",
          "time_start": "13:30",
          "time_end": "14:30",
          "time_display": "1:30pm-2:30pm",
          "instructor": "Cindy",
          "spots_remaining": 1,
          "is_full": false,
          "is_past": false,
          "raw_text": "01/13/26, 1:30 pm - 2:30 pm; Cindy\n\t\t\t\t\t\t\t\t\t -- 1 remaining"
        },
        {
          "date": "2026-01-13",
          "date_display": "01/13/2026",
          "time_start": "14:30",
          "time_end": "15:30",
          "time_display": "2:30pm-3:30pm",
          "instructor": "Cindy",
          "spots_remaining": 1,
          "is_full": false,
          "is_past": false,
          "raw_text": "01/13/26, 2:30 pm - 3:30 pm; Cindy\n\t\t\t\t\t\t\t\t\t -- 1 remaining"
        },
        {
          "date": "2026-01-14",
          "date_display": "01/14/2026",
          "time_start": "12:30",
          "time_end": "13:30",
          "time_display": "12:30pm-1:30pm",
          "instructor": "Cindy",
          "spots_remaining": 1,
          "is_full": false,
          "is_past": false,
          "raw_text": "01/14/26, 12:30 pm - 1:30 pm; Cindy\n\t\t\t\t\t\t\t\t\t -- 1 remaining"
        },
        {
          "date": "2026-01-15",
          "date_display": "01/15/2026",
          "time_start": "09:00",
          "time_end": "10:00",
          "time_display": "9:00am-10:00am",
          "instructor": "Cindy",
          "spots_remaining": 1,
          "is_full": false,
          "is_past": false,
          "raw_text": "01/15/26, 9:00 am - 10:00 am; Cindy\n\t\t\t\t\t\t\t\t\t -- 1 remaining"
        },
        {
          "date": "2026-01-15",
          "date_display": "01/15/2026",
          "time_start": "15:00",
          "time_end": "16:00",
          "time_display": "3:00pm-4:00pm",
          "instructor": "Cindy",
          "spots_remaining": 1,
          "is_full": false,
          "is_past": false,
          "raw_text": "01/15/26, 3:00 pm - 4:00 pm; Cindy\n\t\t\t\t\t\t\t\t\t -- 1 remaining"
        },
        {
          "date": "2026-01-20",
          "date_display": "01/20/2026",
          "time_start": "12:30",
          "time_end": "13:30",
          "time_display": "12:30pm-1:30pm",
          "instructor": "Cindy",
          "spots_remaining": 1,
          "is_full": false,
          "is_past": false,
          "raw_text": "01/20/26, 12:30 pm - 1:30 pm; Cindy\n\t\t\t\t\t\t\t\t\t -- 1 remaining"
        },
        {
          "date": "2026-01-20",
          "date_display": "01/20/2026",
          "time_start": "15:00",
          "time_end": "16:00",
          "time_display": "3:00pm-4:00pm",
          "instructor": "Cindy",
          "spots_remaining": 1,
          "is_full": false,
          "is_past": false,
          "raw_text": "01/20/26, 3:00 pm - 4:00 pm; Cindy\n\t\t\t\t\t\t\t\t\t -- 1 remaining"
        },
        {
          "date": "2026-01-21",
          "date_display": "01/21/2026",
          "time_start": "09:00",
          "time_end": "10:00",
          "time_display": "9:00am-10:00am",
          "instructor": "Cindy",
          "spots_remaining": 1,
          "is_full": false,
          "is_past": false,
          "raw_text": "01/21/26, 9:00 am - 10:00 am; Cindy\n\t\t\t\t\t\t\t\t\t -- 1 remaining"
        },
        {
          "date": "2026-01-22",
          "date_display": "01/22/2026",
          "time_start": "09:00",
          "time_end": "10:00",
          "time_display": "9:00am-10:00am",
          "instructor": "Cindy",
          "spots_remaining": 1,
          "is_full": false,
          "is_past": false,
          "raw_text": "01/22/26, 9:00 am - 10:00 am; Cindy\n\t\t\t\t\t\t\t\t\t -- 1 remaining"
        },
        {
          "date": "2026-01-22",
          "date_display": "01/22/2026",
          "time_start": "14:30",
          "time_end": "15:30",
          "time_display": "2:30pm-3:30pm",
          "instructor": "Cindy",
          "spots_remaining": 1,
          "is_full": false,
          "is_past": false,
          "raw_text": "01/22/26, 2:30 pm - 3:30 pm; Cindy\n\t\t\t\t\t\t\t\t\t -- 1 remaining"
        },
        {
          "date": "2026-01-26",
          "date_display": "01/26/2026",
          "time_start": "09:00",
          "time_end": "10:00",
          "time_display": "9:00am-10:00am",
          "instructor": "Cindy",
          "spots_remaining": 1,
          "is_full": false,
          "is_past": false,
          "raw_text": "01/26/26, 9:00 am - 10:00 am; Cindy\n\t\t\t\t\t\t\t\t\t -- 1 remaining"
        },
        {
          "date": "2026-01-27",
          "date_display": "01/27/2026",
          "time_start": "11:00",
          "time_end": "12:00",
          "time_display": "11:00am-12:00pm",
          "instructor": "Cindy",
          "spots_remaining": 1,
          "is_full": false,
          "is_past": false,
          "raw_text": "01/27/26, 11:00 am - 12:00 pm; Cindy\n\t\t\t\t\t\t\t\t\t -- 1 remaining"
        },
        {
          "date": "2026-01-27",
          "date_display": "01/27/2026",
          "time_start": "15:00",
          "time_end": "16:00",
          "time_display": "3:00pm-4:00pm",
          "instructor": "Cindy",
          "spots_remaining": 1,
          "is_full": false,
          "is_past": false,
          "raw_text": "01/27/26, 3:00 pm - 4:00 pm; Cindy\n\t\t\t\t\t\t\t\t\t -- 1 remaining"
        }
      ],
      "last_updated": "2026-01-05T09:21:48.016647"
    },
    {
      "class_name": "Indeed Lab",
      "location": "GRC",
      "location_full": "Goodwill Resource Center (South Austin)",
      "form_url": "https://gwcareeradvancement.wufoo.com/forms/grc-indeed-lab/",
      "sessions": [
        {
          "date": null,
          "date_display": "-- 0 remaining",
          "time_start": null,
          "time_end": null,
          "time_display": null,
          "instructor": null,
          "spots_remaining": 0,
          "is_full": true,
          "is_past": false,
          "raw_text": "-- 0 remaining"
        },
        {
          "date": "2026-01-02",
          "date_display": "01/02/2026",
          "time_start": "13:30",
          "time_end": "15:30",
          "time_display": "1:30pm-3:30pm",
          "instructor": "Mary",
          "spots_remaining": 3,
          "is_full": false,
          "is_past": true,
          "raw_text": "1/2/26, 1:30pm–3:30pm, Mary\n\t\t\t\t\t\t\t\t\t -- 3 remaining"
        },
        {
          "date": "2026-01-06",
          "date_display": "01/06/2026",
          "time_start": "11:00",
          "time_end": "13:00",
          "time_display": "11:00am-1:00pm",
          "instructor": "Mary",
          "spots_remaining": 5,
          "is_full": false,
          "is_past": false,
          "raw_text": "1/6/26, 11:00am–1:00pm, Mary\n\t\t\t\t\t\t\t\t\t -- 5 remaining"
        },
        {
          "date": "2026-01-06",
          "date_display": "01/06/2026",
          "time_start": "11:00",
          "time_end": "13:00",
          "time_display": "11:00am-1:00pm",
          "instructor": "Mary",
          "spots_remaining": 5,
          "is_full": false,
          "is_past": false,
          "raw_text": "1/6/26, 11:00am–1:00pm, Mary\n\t\t\t\t\t\t\t\t\t -- 5 remaining"
        },
        {
          "date": "2026-01-07",
          "date_display": "01/07/2026",
          "time_start": "13:30",
          "time_end": "15:30",
          "time_display": "1:30pm-3:30pm",
          "instructor": "Mary",
          "spots_remaining": 5,
          "is_full": false,
          "is_past": false,
          "raw_text": "1/7/26, 1:30pm–3:30pm, Mary\n\t\t\t\t\t\t\t\t\t -- 5 remaining"
        },
        {
          "date": "2026-01-13",
          "date_display": "01/13/2026",
          "time_start": "13:00",
          "time_end": "15:00",
          "time_display": "1:00pm-3:00pm",
          "instructor": "Mary",
          "spots_remaining": 5,
          "is_full": false,
          "is_past": false,
          "raw_text": "1/13/26, 1:00pm–3:00pm, Mary\n\t\t\t\t\t\t\t\t\t -- 5 remaining"
        },
        {
          "date": "2026-01-15",
          "date_display": "01/15/2026",
          "time_start": "13:00",
          "time_end": "15:00",
          "time_display": "1:00pm-3:00pm",
          "instructor": "Mary",
          "spots_remaining": 5,
          "is_full": false,
          "is_past": false,
          "raw_text": "1/15/26, 1:00pm–3:00pm, Mary\n\t\t\t\t\t\t\t\t\t -- 5 remaining"
        },
        {
          "date": "2026-01-20",
          "date_display": "01/20/2026",
          "time_start": "09:00",
          "time_end": "11:00",
          "time_display": "9:00am-11:00am",
          "instructor": "Mary",
          "spots_remaining": 5,
          "is_full": false,
          "is_past": false,
          "raw_text": "1/20/26, 9:00am–11:00am, Mary\n\t\t\t\t\t\t\t\t\t -- 5 remaining"
        },
        {
          "date": "2026-01-21",
          "date_display": "01/21/2026",
          "time_start": "10:30",
          "time_end": "12:30",
          "time_display": "10:30am-12:30pm",
          "instructor": "Mary",
          "spots_remaining": 5,
          "is_full": false,
          "is_past": false,
          "raw_text": "1/21/26, 10:30am–12:30pm, Mary\n\t\t\t\t\t\t\t\t\t -- 5 remaining"
        },
        {
          "date": "2026-01-22",
          "date_display": "01/22/2026",
          "time_start": "11:00",
          "time_end": "13:00",
          "time_display": "11:00am-1:00pm",
          "instructor": "Mary",
          "spots_remaining": 5,
          "is_full": false,
          "is_past": false,
          "raw_text": "1/22/26, 11:00am–1:00pm, Mary\n\t\t\t\t\t\t\t\t\t -- 5 remaining"
        },
        {
          "date": "2026-01-26",
          "date_display": "01/26/2026",
          "time_start": "10:30",
          "time_end": "12:30",
          "time_display": "10:30am-12:30pm",
          "instructor": "Mary",
          "spots_remaining": 5,
          "is_full": false,
          "is_past": false,
          "raw_text": "1/26/26, 10:30am–12:30pm, Mary\n\t\t\t\t\t\t\t\t\t -- 5 remaining"
        },
        {
          "date": "2026-01-27",
          "date_display": "01/27/2026",
          "time_start": "12:30",
          "time_end": "14:30",
          "time_display": "12:30pm-2:30pm",
          "instructor": "Mary",
          "spots_remaining": 5,
          "is_full": false,
          "is_past": false,
          "raw_text": "1/27/26, 12:30pm–2:30pm, Mary\n\t\t\t\t\t\t\t\t\t -- 5 remaining"
        },
        {
          "date": "2026-01-29",
          "date_display": "01/29/2026",
          "time_start": "12:00",
          "time_end": "13:00",
          "time_display": "12:00pm-1:00pm",
          "instructor": "Mary",
          "spots_remaining": 1,
          "is_full": false,
          "is_past": false,
          "raw_text": "1/29/26, 12:00pm–1:00pm, Mary\n\t\t\t\t\t\t\t\t\t -- 1 remaining"
        },
        {
          "date": "2026-01-30",
          "date_display": "01/30/2026",
          "time_start": "13:30",
          "time_end": "15:30",
          "time_display": "1:30pm-3:30pm",
          "instructor": "Mary",
          "spots_remaining": 5,
          "is_full": false,
          "is_past": false,
          "raw_text": "1/30/26, 1:30pm–3:30pm, Mary\n\t\t\t\t\t\t\t\t\t -- 5 remaining"
        }
      ],
      "last_updated": "2026-01-05T09:21:51.615663"
    },
    {
      "class_name": "Interview Preparation & Practice",
      "location": "GRC",
      "location_full": "Goodwill Resource Center (South Austin)",
      "form_url": "https://gwcareeradvancement.wufoo.com/forms/grc-interview-preparation-and-practice/",
      "sessions": [
        {
          "date": null,
          "date_display": "Select from Dropdown\n\t\t\t\t\t\t\t\t\t -- 0 remaining",
          "time_start": null,
          "time_end": null,
          "time_display": null,
          "instructor": null,
          "spots_remaining": 0,
          "is_full": true,
          "is_past": false,
          "raw_text": "Select from Dropdown\n\t\t\t\t\t\t\t\t\t -- 0 remaining"
        },
        {
          "date": "2025-12-31",
          "date_display": "12/31/2025",
          "time_start": null,
          "time_end": null,
          "time_display": null,
          "instructor": "Mary",
          "spots_remaining": 4,
          "is_full": false,
          "is_past": true,
          "raw_text": "12/31/25. 10am-Noon, Mary\n\t\t\t\t\t\t\t\t\t -- 4 remaining"
        },
        {
          "date": "2025-01-06",
          "date_display": "01/06/2025",
          "time_start": "09:00",
          "time_end": "11:00",
          "time_display": "9:00am-11:00am",
          "instructor": "Mary",
          "spots_remaining": 4,
          "is_full": false,
          "is_past": true,
          "raw_text": "01/6/25, 9:00am–11:00am, Mary\n\t\t\t\t\t\t\t\t\t -- 4 remaining"
        },
        {
          "date": "2025-01-08",
          "date_display": "01/08/2025",
          "time_start": "12:30",
          "time_end": "14:30",
          "time_display": "12:30pm-2:30pm",
          "instructor": "Mary",
          "spots_remaining": 4,
          "is_full": false,
          "is_past": true,
          "raw_text": "01/8/25, 12:30pm–2:30pm, Mary\n\t\t\t\t\t\t\t\t\t -- 4 remaining"
        },
        {
          "date": "2025-01-12",
          "date_display": "01/12/2025",
          "time_start": "14:00",
          "time_end": "16:00",
          "time_display": "2:00pm-4:00pm",
          "instructor": "Mary",
          "spots_remaining": 4,
          "is_full": false,
          "is_past": true,
          "raw_text": "01/12/25, 2:00pm–4:00pm, Mary\n\t\t\t\t\t\t\t\t\t -- 4 remaining"
        },
        {
          "date": "2025-01-15",
          "date_display": "01/15/2025",
          "time_start": "11:00",
          "time_end": "13:00",
          "time_display": "11:00am-1:00pm",
          "instructor": "Cindy",
          "spots_remaining": 4,
          "is_full": false,
          "is_past": true,
          "raw_text": "01/15/25, 11:00am–1:00pm, Cindy\n\t\t\t\t\t\t\t\t\t -- 4 remaining"
        },
        {
          "date": "2025-01-21",
          "date_display": "01/21/2025",
          "time_start": "13:00",
          "time_end": "15:00",
          "time_display": "1:00pm-3:00pm",
          "instructor": "Mary",
          "spots_remaining": 4,
          "is_full": false,
          "is_past": true,
          "raw_text": "01/21/25, 1:00pm–3:00pm, Mary\n\t\t\t\t\t\t\t\t\t -- 4 remaining"
        },
        {
          "date": "2025-01-22",
          "date_display": "01/22/2025",
          "time_start": "09:00",
          "time_end": "11:00",
          "time_display": "9:00am-11:00am",
          "instructor": "Mary",
          "spots_remaining": 4,
          "is_full": false,
          "is_past": true,
          "raw_text": "01/22/25, 9:00am–11:00am, Mary\n\t\t\t\t\t\t\t\t\t -- 4 remaining"
        },
        {
          "date": "2025-01-26",
          "date_display": "01/26/2025",
          "time_start": "13:00",
          "time_end": "15:00",
          "time_display": "1:00pm-3:00pm",
          "instructor": "Mary",
          "spots_remaining": 4,
          "is_full": false,
          "is_past": true,
          "raw_text": "01/26/25, 1:00pm–3:00pm, Mary\n\t\t\t\t\t\t\t\t\t -- 4 remaining"
        },
        {
          "date": "2025-01-28",
          "date_display": "01/28/2025",
          "time_start": "11:00",
          "time_end": "13:00",
          "time_display": "11:00am-1:00pm",
          "instructor": "Mary",
          "spots_remaining": 4,
          "is_full": false,
          "is_past": true,
          "raw_text": "01/28/25, 11:00am–1:00pm, Mary\n\t\t\t\t\t\t\t\t\t -- 4 remaining"
        },
        {
          "date": "2025-01-29",
          "date_display": "01/29/2025",
          "time_start": "09:00",
          "time_end": "11:00",
          "time_display": "9:00am-11:00am",
          "instructor": "Mary",
          "spots_remaining": 4,
          "is_full": false,
          "is_past": true,
          "raw_text": "01/29/25, 9:00am–11:00am, Mary\n\t\t\t\t\t\t\t\t\t -- 4 remaining"
        }
      ],
      "last_updated": "2026-01-05T09:21:54.907539"
    },
    {
      "class_name": "Job Preparation 1:1",
      "location": "GRC",
      "location_full": "Goodwill Resource Center (South Austin)",
      "form_url": "https://gwcareeradvancement.wufoo.com/forms/grc-job-preparation-11/",
      "sessions": [
        {
          "date": null,
          "date_display": "Select from Dropdown\n\t\t\t\t\t\t\t\t\t -- 0 remaining",
          "time_start": null,
          "time_end": null,
          "time_display": null,
          "instructor": null,
          "spots_remaining": 0,
          "is_full": true,
          "is_past": false,
          "raw_text": "Select from Dropdown\n\t\t\t\t\t\t\t\t\t -- 0 remaining"
        },
        {
          "date": "2026-01-02",
          "date_display": "01/02/2026",
          "time_start": "11:00",
          "time_end": "12:00",
          "time_display": "11:00am-12:00pm",
          "instructor": "Mary",
          "spots_remaining": 1,
          "is_full": false,
          "is_past": true,
          "raw_text": "1/02/26, 11:00am–12:00pm, Mary\n\t\t\t\t\t\t\t\t\t -- 1 remaining"
        },
        {
          "date": "2026-01-05",
          "date_display": "01/05/2026",
          "time_start": "11:00",
          "time_end": "12:00",
          "time_display": "11:00am-12:00pm",
          "instructor": "Cindy",
          "spots_remaining": 1,
          "is_full": false,
          "is_past": true,
          "raw_text": "1/05/26, 11:00am–12:00pm, Cindy\n\t\t\t\t\t\t\t\t\t -- 1 remaining"
        },
        {
          "date": "2026-01-05",
          "date_display": "01/05/2026",
          "time_start": "14:00",
          "time_end": "15:00",
          "time_display": "2:00pm-3:00pm",
          "instructor": "Cindy",
          "spots_remaining": 1,
          "is_full": false,
          "is_past": true,
          "raw_text": "1/05/26, 2:00pm–3:00pm, Cindy\n\t\t\t\t\t\t\t\t\t -- 1 remaining"
        },
        {
          "date": "2026-01-06",
          "date_display": "01/06/2026",
          "time_start": "10:30",
          "time_end": "11:30",
          "time_display": "10:30am-11:30am",
          "instructor": "Cindy",
          "spots_remaining": 1,
          "is_full": false,
          "is_past": false,
          "raw_text": "1/06/26, 10:30am–11:30am, Cindy\n\t\t\t\t\t\t\t\t\t -- 1 remaining"
        },
        {
          "date": "2026-01-06",
          "date_display": "01/06/2026",
          "time_start": "14:00",
          "time_end": "15:00",
          "time_display": "2:00pm-3:00pm",
          "instructor": "Mary",
          "spots_remaining": 1,
          "is_full": false,
          "is_past": false,
          "raw_text": "1/06/26, 2:00pm–3:00pm, Mary\n\t\t\t\t\t\t\t\t\t -- 1 remaining"
        },
        {
          "date": "2026-01-07",
          "date_display": "01/07/2026",
          "time_start": "09:00",
          "time_end": "10:00",
          "time_display": "9:00am-10:00am",
          "instructor": "Mary",
          "spots_remaining": 1,
          "is_full": false,
          "is_past": false,
          "raw_text": "1/07/26, 9:00am–10:00am, Mary\n\t\t\t\t\t\t\t\t\t -- 1 remaining"
        },
        {
          "date": "2026-01-07",
          "date_display": "01/07/2026",
          "time_start": "12:30",
          "time_end": "13:30",
          "time_display": "12:30pm-1:30pm",
          "instructor": "Cindy",
          "spots_remaining": 0,
          "is_full": true,
          "is_past": false,
          "raw_text": "1/07/26, 12:30pm–1:30pm, Cindy\n\t\t\t\t\t\t\t\t\t -- 0 remaining"
        },
        {
          "date": "2026-01-07",
          "date_display": "01/07/2026",
          "time_start": "13:30",
          "time_end": "14:30",
          "time_display": "1:30pm-2:30pm",
          "instructor": "Mary",
          "spots_remaining": 1,
          "is_full": false,
          "is_past": false,
          "raw_text": "1/07/26, 1:30pm–2:30pm, Mary\n\t\t\t\t\t\t\t\t\t -- 1 remaining"
        },
        {
          "date": "2026-01-08",
          "date_display": "01/08/2026",
          "time_start": "10:00",
          "time_end": "11:00",
          "time_display": "10:00am-11:00am",
          "instructor": "Mary",
          "spots_remaining": 1,
          "is_full": false,
          "is_past": false,
          "raw_text": "1/08/26, 10:00am–11:00am, Mary\n\t\t\t\t\t\t\t\t\t -- 1 remaining"
        },
        {
          "date": "2026-01-08",
          "date_display": "01/08/2026",
          "time_start": "15:00",
          "time_end": "16:00",
          "time_display": "3:00pm-4:00pm",
          "instructor": "Mary",
          "spots_remaining": 1,
          "is_full": false,
          "is_past": false,
          "raw_text": "1/08/26, 3:00pm–4:00pm, Mary\n\t\t\t\t\t\t\t\t\t -- 1 remaining"
        },
        {
          "date": "2026-01-12",
          "date_display": "01/12/2026",
          "time_start": "13:00",
          "time_end": "14:00",
          "time_display": "1:00pm-2:00pm",
          "instructor": "Cindy",
          "spots_remaining": 1,
          "is_full": false,
          "is_past": false,
          "raw_text": "1/12/26, 1:00pm–2:00pm, Cindy\n\t\t\t\t\t\t\t\t\t -- 1 remaining"
        },
        {
          "date": "2026-01-12",
          "date_display": "01/12/2026",
          "time_start": "14:30",
          "time_end": "15:30",
          "time_display": "2:30pm-3:30pm",
          "instructor": "Cindy",
          "spots_remaining": 1,
          "is_full": false,
          "is_past": false,
          "raw_text": "1/12/26, 2:30pm–3:30pm, Cindy\n\t\t\t\t\t\t\t\t\t -- 1 remaining"
        },
        {
          "date": "2026-01-14",
          "date_display": "01/14/2026",
          "time_start": "10:30",
          "time_end": "11:30",
          "time_display": "10:30am-11:30am",
          "instructor": "Cindy",
          "spots_remaining": 1,
          "is_full": false,
          "is_past": false,
          "raw_text": "1/14/26, 10:30am–11:30am, Cindy\n\t\t\t\t\t\t\t\t\t -- 1 remaining"
        },
        {
          "date": "2026-01-14",
          "date_display": "01/14/2026",
          "time_start": "13:30",
          "time_end": "14:30",
          "time_display": "1:30pm-2:30pm",
          "instructor": "Mary",
          "spots_remaining": 1,
          "is_full": false,
          "is_past": false,
          "raw_text": "1/14/26, 1:30pm–2:30pm, Mary\n\t\t\t\t\t\t\t\t\t -- 1 remaining"
        },
        {
          "date": "2026-01-15",
          "date_display": "01/15/2026",
          "time_start": "10:00",
          "time_end": "11:00",
          "time_display": "10:00am-11:00am",
          "instructor": "Cindy",
          "spots_remaining": 1,
          "is_full": false,
          "is_past": false,
          "raw_text": "1/15/26, 10:00am–11:00am, Cindy\n\t\t\t\t\t\t\t\t\t -- 1 remaining"
        },
        {
          "date": "2026-01-20",
          "date_display": "01/20/2026",
          "time_start": "11:30",
          "time_end": "12:30",
          "time_display": "11:30am-12:30pm",
          "instructor": "Mary",
          "spots_remaining": 1,
          "is_full": false,
          "is_past": false,
          "raw_text": "1/20/26, 11:30am–12:30pm, Mary\n\t\t\t\t\t\t\t\t\t -- 1 remaining"
        },
        {
          "date": "2026-01-20",
          "date_display": "01/20/2026",
          "time_start": "14:00",
          "time_end": "15:00",
          "time_display": "2:00pm-3:00pm",
          "instructor": "Cindy",
          "spots_remaining": 1,
          "is_full": false,
          "is_past": false,
          "raw_text": "1/20/26, 2:00pm–3:00pm, Cindy\n\t\t\t\t\t\t\t\t\t -- 1 remaining"
        },
        {
          "date": "2026-01-21",
          "date_display": "01/21/2026",
          "time_start": "09:00",
          "time_end": "10:00",
          "time_display": "9:00am-10:00am",
          "instructor": "Mary",
          "spots_remaining": 1,
          "is_full": false,
          "is_past": false,
          "raw_text": "1/21/26, 9:00am–10:00am, Mary\n\t\t\t\t\t\t\t\t\t -- 1 remaining"
        },
        {
          "date": "2026-01-21",
          "date_display": "01/21/2026",
          "time_start": "10:00",
          "time_end": "11:00",
          "time_display": "10:00am-11:00am",
          "instructor": "Cindy",
          "spots_remaining": 1,
          "is_full": false,
          "is_past": false,
          "raw_text": "1/21/26, 10:00am–11:00am, Cindy\n\t\t\t\t\t\t\t\t\t -- 1 remaining"
        },
        {
          "date": "2026-01-22",
          "date_display": "01/22/2026",
          "time_start": "13:00",
          "time_end": "14:00",
          "time_display": "1:00pm-2:00pm",
          "instructor": "Cindy",
          "spots_remaining": 1,
          "is_full": false,
          "is_past": false,
          "raw_text": "1/22/26, 1:00pm–2:00pm, Cindy\n\t\t\t\t\t\t\t\t\t -- 1 remaining"
        },
        {
          "date": "2026-01-26",
          "date_display": "01/26/2026",
          "time_start": "21:00",
          "time_end": "10:00",
          "time_display": "9:00pm-10:00am",
          "instructor": "Mary",
          "spots_remaining": 1,
          "is_full": false,
          "is_past": false,
          "raw_text": "1/26/26, 9:00pm–10:00am, Mary\n\t\t\t\t\t\t\t\t\t -- 1 remaining"
        },
        {
          "date": "2026-01-26",
          "date_display": "01/26/2026",
          "time_start": "10:00",
          "time_end": "11:00",
          "time_display": "10:00am-11:00am",
          "instructor": "Cindy",
          "spots_remaining": 1,
          "is_full": false,
          "is_past": false,
          "raw_text": "1/26/26, 10:00am–11:00am, Cindy\n\t\t\t\t\t\t\t\t\t -- 1 remaining"
        },
        {
          "date": "2026-01-27",
          "date_display": "01/27/2026",
          "time_start": "10:30",
          "time_end": "11:30",
          "time_display": "10:30am-11:30am",
          "instructor": "Mary",
          "spots_remaining": 1,
          "is_full": false,
          "is_past": false,
          "raw_text": "1/27/26, 10:30am–11:30am, Mary\n\t\t\t\t\t\t\t\t\t -- 1 remaining"
        },
        {
          "date": "2026-01-29",
          "date_display": "01/29/2026",
          "time_start": "09:00",
          "time_end": "10:00",
          "time_display": "9:00am-10:00am",
          "instructor": "Cindy",
          "spots_remaining": 1,
          "is_full": false,
          "is_past": false,
          "raw_text": "1/29/26, 9:00am–10:00am, Cindy\n\t\t\t\t\t\t\t\t\t -- 1 remaining"
        },
        {
          "date": "2026-01-29",
          "date_display": "01/29/2026",
          "time_start": "14:30",
          "time_end": "15:30",
          "time_display": "2:30pm-3:30pm",
          "instructor": "Mary",
          "spots_remaining": 1,
          "is_full": false,
          "is_past": false,
          "raw_text": "1/29/26, 2:30pm–3:30pm, Mary\n\t\t\t\t\t\t\t\t\t -- 1 remaining"
        },
        {
          "date": "2026-01-30",
          "date_display": "01/30/2026",
          "time_start": "10:00",
          "time_end": "11:00",
          "time_display": "10:00am-11:00am",
          "instructor": "Mary",
          "spots_remaining": 1,
          "is_full": false,
          "is_past": false,
          "raw_text": "1/30/26, 10:00am–11:00am, Mary\n\t\t\t\t\t\t\t\t\t -- 1 remaining"
        }
      ],
      "last_updated": "2026-01-05T09:21:58.237868"
    },
    {
      "class_name": "Online Safety",
      "location": "GRC",
      "location_full": "Goodwill Resource Center (South Austin)",
      "form_url": "https://gwcareeradvancement.wufoo.com/forms/grc-online-safety/",
      "sessions": [
        {
          "date": null,
          "date_display": "Select from Dropdown\n\t\t\t\t\t\t\t\t\t -- 0 remaining",
          "time_start": null,
          "time_end": null,
          "time_display": null,
          "instructor": null,
          "spots_remaining": 0,
          "is_full": true,
          "is_past": false,
          "raw_text": "Select from Dropdown\n\t\t\t\t\t\t\t\t\t -- 0 remaining"
        },
        {
          "date": "2025-10-27",
          "date_display": "10/27/2025",
          "time_start": "14:30",
          "time_end": "15:30",
          "time_display": "2:30pm-3:30pm",
          "instructor": "Cindy",
          "spots_remaining": 4,
          "is_full": false,
          "is_past": true,
          "raw_text": "10/27/25, 2:30 pm - 3:30 pm; Cindy\n\t\t\t\t\t\t\t\t\t -- 4 remaining"
        },
        {
          "date": "2025-11-17",
          "date_display": "11/17/2025",
          "time_start": "14:30",
          "time_end": "15:30",
          "time_display": "2:30pm-3:30pm",
          "instructor": "Cindy",
          "spots_remaining": 4,
          "is_full": false,
          "is_past": true,
          "raw_text": "11/17/25, 2:30 pm - 3:30 pm; Cindy\n\t\t\t\t\t\t\t\t\t -- 4 remaining"
        }
      ],
      "last_updated": "2026-01-05T09:22:01.889624"
    },
    {
      "class_name": "Virtual Career Advancement Essentials",
      "location": "GRC",
      "location_full": "Goodwill Resource Center (South Austin)",
      "form_url": "https://gwcareeradvancement.wufoo.com/forms/virtual-career-advancement-essentials/",
      "sessions": [
        {
          "date": "2025-12-15",
          "date_display": "December 15-19",
          "time_start": null,
          "time_end": null,
          "time_display": null,
          "instructor": "Alex",
          "spots_remaining": 1,
          "is_full": false,
          "is_past": true,
          "raw_text": "December 15-19; Alex\n\t\t\t\t\t\t\t\t\t -- 1 remaining"
        },
        {
          "date": "2026-01-26",
          "date_display": "January 26-30",
          "time_start": null,
          "time_end": null,
          "time_display": null,
          "instructor": "Alex",
          "spots_remaining": 4,
          "is_full": false,
          "is_past": false,
          "raw_text": "January 26-30; Alex\n\t\t\t\t\t\t\t\t\t -- 4 remaining"
        }
      ],
      "last_updated": "2026-01-05T09:22:05.490554"
    },
    {
      "class_name": "Budgeting Basics",
      "location": "GCC",
      "location_full": "Goodwill Community Center (North Austin)",
      "form_url": "https://gwcareeradvancement.wufoo.com/forms/gcc-budgeting-basics/",
      "sessions": [
        {
          "date": null,
          "date_display": "Select from Dropdown\n\t\t\t\t\t\t\t\t\t -- 0 remaining",
          "time_start": null,
          "time_end": null,
          "time_display": null,
          "instructor": null,
          "spots_remaining": 0,
          "is_full": true,
          "is_past": false,
          "raw_text": "Select from Dropdown\n\t\t\t\t\t\t\t\t\t -- 0 remaining"
        },
        {
          "date": "2025-12-16",
          "date_display": "12/16/2025",
          "time_start": "09:00",
          "time_end": "11:00",
          "time_display": "9:00AM-11:00AM",
          "instructor": "Doug",
          "spots_remaining": 0,
          "is_full": true,
          "is_past": true,
          "raw_text": "12/16/25, 9:00-11:00 AM; Doug\n\t\t\t\t\t\t\t\t\t -- 0 remaining"
        },
        {
          "date": "2025-12-18",
          "date_display": "12/18/2025",
          "time_start": "10:30",
          "time_end": "12:30",
          "time_display": "10:30AM-12:30PM",
          "instructor": "Doug",
          "spots_remaining": 0,
          "is_full": true,
          "is_past": true,
          "raw_text": "12/18/25 10:30 AM - 12:30 PM; Doug\n\t\t\t\t\t\t\t\t\t -- 0 remaining"
        },
        {
          "date": "2025-12-22",
          "date_display": "12/22/2025",
          "time_start": "10:30",
          "time_end": "12:30",
          "time_display": "10:30AM-12:30PM",
          "instructor": "Doug",
          "spots_remaining": 1,
          "is_full": false,
          "is_past": true,
          "raw_text": "12/22/25, 10:30 AM-12:30 PM; Doug\n\t\t\t\t\t\t\t\t\t -- 1 remaining"
        },
        {
          "date": "2026-01-05",
          "date_display": "01/05/2026",
          "time_start": "09:00",
          "time_end": "11:00",
          "time_display": "9:00am-11:00am",
          "instructor": "Doug",
          "spots_remaining": 3,
          "is_full": false,
          "is_past": true,
          "raw_text": "01/05/2026, 9:00-11:00am, Doug\n\t\t\t\t\t\t\t\t\t -- 3 remaining"
        },
        {
          "date": "2026-01-06",
          "date_display": "01/06/2026",
          "time_start": "13:00",
          "time_end": "15:00",
          "time_display": "1:00pm-3:00pm",
          "instructor": "Doug",
          "spots_remaining": 4,
          "is_full": false,
          "is_past": false,
          "raw_text": "01/06/2026, 1:00-3:00pm, Doug\n\t\t\t\t\t\t\t\t\t -- 4 remaining"
        },
        {
          "date": "2026-01-07",
          "date_display": "01/07/2026",
          "time_start": "12:30",
          "time_end": "14:30",
          "time_display": "12:30pm-2:30pm",
          "instructor": "Doug",
          "spots_remaining": 4,
          "is_full": false,
          "is_past": false,
          "raw_text": "01/07/2026, 12:30-2:30pm, Doug\n\t\t\t\t\t\t\t\t\t -- 4 remaining"
        },
        {
          "date": "2026-01-08",
          "date_display": "01/08/2026",
          "time_start": "13:00",
          "time_end": "15:00",
          "time_display": "1:00pm-3:00pm",
          "instructor": "Doug",
          "spots_remaining": 0,
          "is_full": true,
          "is_past": false,
          "raw_text": "01/08/2026, 1:00-3:00pm, Doug\n\t\t\t\t\t\t\t\t\t -- 0 remaining"
        },
        {
          "date": "2026-01-12",
          "date_display": "01/12/2026",
          "time_start": "10:30",
          "time_end": "12:30",
          "time_display": "10:30am-12:30pm",
          "instructor": "Doug",
          "spots_remaining": 0,
          "is_full": true,
          "is_past": false,
          "raw_text": "01/12/2026, 10:30-12:30pm, Doug\n\t\t\t\t\t\t\t\t\t -- 0 remaining"
        },
        {
          "date": "2026-01-13",
          "date_display": "01/13/2026",
          "time_start": "09:00",
          "time_end": "11:00",
          "time_display": "9:00am-11:00am",
          "instructor": "Doug",
          "spots_remaining": 4,
          "is_full": false,
          "is_past": false,
          "raw_text": "01/13/2026, 9:00-11:00am, Doug\n\t\t\t\t\t\t\t\t\t -- 4 remaining"
        },
        {
          "date": "2026-01-15",
          "date_display": "01/15/2026",
          "time_start": null,
          "time_end": null,
          "time_display": null,
          "instructor": "Doug",
          "spots_remaining": 4,
          "is_full": false,
          "is_past": false,
          "raw_text": "01/15/2026, 10-Noon, Doug\n\t\t\t\t\t\t\t\t\t -- 4 remaining"
        },
        {
          "date": "2026-01-20",
          "date_display": "01/20/2026",
          "time_start": "13:00",
          "time_end": "15:00",
          "time_display": "1:00pm-3:00pm",
          "instructor": "Doug",
          "spots_remaining": 4,
          "is_full": false,
          "is_past": false,
          "raw_text": "01/20/2026, 1:00-3:00pm, Doug\n\t\t\t\t\t\t\t\t\t -- 4 remaining"
        },
        {
          "date": "2026-01-21",
          "date_display": "01/21/2026",
          "time_start": "13:30",
          "time_end": "15:30",
          "time_display": "1:30pm-3:30pm",
          "instructor": "Doug",
          "spots_remaining": 4,
          "is_full": false,
          "is_past": false,
          "raw_text": "01/21/2026, 1:30-3:30pm, Doug\n\t\t\t\t\t\t\t\t\t -- 4 remaining"
        },
        {
          "date": "2026-01-25",
          "date_display": "01/25/2026",
          "time_start": "09:00",
          "time_end": "11:00",
          "time_display": "9:00am-11:00am",
          "instructor": "Doug",
          "spots_remaining": 4,
          "is_full": false,
          "is_past": false,
          "raw_text": "01/25/2026, 9:00-11:00am, Doug\n\t\t\t\t\t\t\t\t\t -- 4 remaining"
        },
        {
          "date": "2026-01-28",
          "date_display": "01/28/2026",
          "time_start": null,
          "time_end": null,
          "time_display": null,
          "instructor": "Doug",
          "spots_remaining": 4,
          "is_full": false,
          "is_past": false,
          "raw_text": "01/28/2026, 10:00-Noon, Doug\n\t\t\t\t\t\t\t\t\t -- 4 remaining"
        }
      ],
      "last_updated": "2026-01-05T09:22:09.038778"
    },
    {
      "class_name": "Career Advancement Essentials",
      "location": "GCC",
      "location_full": "Goodwill Community Center (North Austin)",
      "form_url": "https://gwcareeradvancement.wufoo.com/forms/gcc-career-advancement-essentials/",
      "sessions": [
        {
          "date": "2025-12-01",
          "date_display": "December 1-5",
          "time_start": "09:00",
          "time_end": "12:00",
          "time_display": "9:00am-12:00pm",
          "instructor": "Alex",
          "spots_remaining": 1,
          "is_full": false,
          "is_past": true,
          "raw_text": "December 1-5, 9:00am-12:00pm; Alex\n\t\t\t\t\t\t\t\t\t -- 1 remaining"
        },
        {
          "date": "2026-01-05",
          "date_display": "January 5-9",
          "time_start": "09:00",
          "time_end": "12:00",
          "time_display": "9:00am-12:00pm",
          "instructor": "Alex",
          "spots_remaining": 0,
          "is_full": true,
          "is_past": true,
          "raw_text": "January 5-9, 9:00am-12:00pm, Alex\n\t\t\t\t\t\t\t\t\t -- 0 remaining"
        }
      ],
      "last_updated": "2026-01-05T09:22:12.580003"
    },
    {
      "class_name": "Computer Basics/Keyboarding",
      "location": "GCC",
      "location_full": "Goodwill Community Center (North Austin)",
      "form_url": "https://gwcareeradvancement.wufoo.com/forms/gcc-computer-basics/",
      "sessions": [
        {
          "date": null,
          "date_display": "Select from Dropdown\n\t\t\t\t\t\t\t\t\t -- 0 remaining",
          "time_start": null,
          "time_end": null,
          "time_display": null,
          "instructor": null,
          "spots_remaining": 0,
          "is_full": true,
          "is_past": false,
          "raw_text": "Select from Dropdown\n\t\t\t\t\t\t\t\t\t -- 0 remaining"
        },
        {
          "date": "2025-08-28",
          "date_display": "08/28/2025",
          "time_start": "01:00",
          "time_end": "03:00",
          "time_display": "1:00-3:00",
          "instructor": "Adryan",
          "spots_remaining": 0,
          "is_full": true,
          "is_past": true,
          "raw_text": "08/28/25, 1:00-3:00; Adryan\n\t\t\t\t\t\t\t\t\t -- 0 remaining"
        },
        {
          "date": "2025-10-02",
          "date_display": "10/02/2025",
          "time_start": "13:00",
          "time_end": "15:00",
          "time_display": "1:00pm-3:00pm",
          "instructor": "Adryan",
          "spots_remaining": 5,
          "is_full": false,
          "is_past": true,
          "raw_text": "10/02/25, 1:00-3:00pm, Adryan\n\t\t\t\t\t\t\t\t\t -- 5 remaining"
        },
        {
          "date": "2026-01-06",
          "date_display": "01/06/2026",
          "time_start": "09:00",
          "time_end": "10:30",
          "time_display": "9:00am-10:30am",
          "instructor": "Adryan",
          "spots_remaining": 4,
          "is_full": false,
          "is_past": false,
          "raw_text": "01/06/26, 9:00-10:30am, Adryan\n\t\t\t\t\t\t\t\t\t -- 4 remaining"
        },
        {
          "date": "2026-01-09",
          "date_display": "01/09/2026",
          "time_start": "09:00",
          "time_end": "10:30",
          "time_display": "9:00am-10:30am",
          "instructor": "Adryan",
          "spots_remaining": 4,
          "is_full": false,
          "is_past": false,
          "raw_text": "01/09/26, 9:00-10:30am, Adryan\n\t\t\t\t\t\t\t\t\t -- 4 remaining"
        },
        {
          "date": "2026-01-16",
          "date_display": "01/16/2026",
          "time_start": "12:00",
          "time_end": "13:30",
          "time_display": "12:00pm-1:30pm",
          "instructor": "Adryan",
          "spots_remaining": 4,
          "is_full": false,
          "is_past": false,
          "raw_text": "01/16/26, 12:00-1:30pm, Adryan\n\t\t\t\t\t\t\t\t\t -- 4 remaining"
        },
        {
          "date": "2026-01-22",
          "date_display": "01/22/2026",
          "time_start": "12:00",
          "time_end": "13:30",
          "time_display": "12:00pm-1:30pm",
          "instructor": "Adryan",
          "spots_remaining": 4,
          "is_full": false,
          "is_past": false,
          "raw_text": "01/22/26, 12:00-1:30pm, Adryan\n\t\t\t\t\t\t\t\t\t -- 4 remaining"
        },
        {
          "date": "2026-01-28",
          "date_display": "01/28/2026",
          "time_start": "11:00",
          "time_end": "12:30",
          "time_display": "11:00am-12:30pm",
          "instructor": "Adryan",
          "spots_remaining": 4,
          "is_full": false,
          "is_past": false,
          "raw_text": "01/28/26, 11:00am-12:30pm, Adryan\n\t\t\t\t\t\t\t\t\t -- 4 remaining"
        }
      ],
      "last_updated": "2026-01-05T09:22:16.003708"
    },
    {
      "class_name": "Credit Basics",
      "location": "GCC",
      "location_full": "Goodwill Community Center (North Austin)",
      "form_url": "https://gwcareeradvancement.wufoo.com/forms/x1eozbd71npnt5q/",
      "sessions": [
        {
          "date": null,
          "date_display": "-- 0 remaining",
          "time_start": null,
          "time_end": null,
          "time_display": null,
          "instructor": null,
          "spots_remaining": 0,
          "is_full": true,
          "is_past": false,
          "raw_text": "-- 0 remaining"
        },
        {
          "date": "2026-01-09",
          "date_display": "01/09/2026",
          "time_start": "09:00",
          "time_end": "11:00",
          "time_display": "9:00-11:00",
          "instructor": "Cindy",
          "spots_remaining": 4,
          "is_full": false,
          "is_past": false,
          "raw_text": "01/09/2026, 9:00-11:00; Cindy\n\t\t\t\t\t\t\t\t\t -- 4 remaining"
        },
        {
          "date": "2026-01-13",
          "date_display": "01/13/2026",
          "time_start": "10:30",
          "time_end": "12:30",
          "time_display": "10:30-12:30",
          "instructor": "Cindy",
          "spots_remaining": 4,
          "is_full": false,
          "is_past": false,
          "raw_text": "01/13/2026, 10:30-12:30; Cindy\n\t\t\t\t\t\t\t\t\t -- 4 remaining"
        },
        {
          "date": "2026-01-27",
          "date_display": "01/27/2026",
          "time_start": "09:00",
          "time_end": "11:00",
          "time_display": "9:00-11:00",
          "instructor": "Cindy",
          "spots_remaining": 4,
          "is_full": false,
          "is_past": false,
          "raw_text": "01/27/2026, 9:00-11:00; Cindy\n\t\t\t\t\t\t\t\t\t -- 4 remaining"
        }
      ],
      "last_updated": "2026-01-05T09:22:19.494112"
    },
    {
      "class_name": "Digital Skills 1:1",
      "location": "GCC",
      "location_full": "Goodwill Community Center (North Austin)",
      "form_url": "https://gwcareeradvancement.wufoo.com/forms/gcc-digital-skills-11/",
      "sessions": [
        {
          "date": null,
          "date_display": "Select from Dropdown\n\t\t\t\t\t\t\t\t\t -- 0 remaining",
          "time_start": null,
          "time_end": null,
          "time_display": null,
          "instructor": null,
          "spots_remaining": 0,
          "is_full": true,
          "is_past": false,
          "raw_text": "Select from Dropdown\n\t\t\t\t\t\t\t\t\t -- 0 remaining"
        },
        {
          "date": "2025-12-30",
          "date_display": "12/30/2025",
          "time_start": "12:30",
          "time_end": "13:30",
          "time_display": "12:30pm-1:30pm",
          "instructor": "Alex",
          "spots_remaining": 0,
          "is_full": true,
          "is_past": true,
          "raw_text": "12/30/25, 12:30-1:30pm; Alex\n\t\t\t\t\t\t\t\t\t -- 0 remaining"
        },
        {
          "date": "2025-12-18",
          "date_display": "12/18/2025",
          "time_start": "11:00",
          "time_end": "12:00",
          "time_display": "11:00am-12:00pm",
          "instructor": "Adryan",
          "spots_remaining": 0,
          "is_full": true,
          "is_past": true,
          "raw_text": "12/18/25, 11:00-12:00pm, Adryan\n\t\t\t\t\t\t\t\t\t -- 0 remaining"
        },
        {
          "date": "2025-12-19",
          "date_display": "12/19/2025",
          "time_start": "14:00",
          "time_end": "15:00",
          "time_display": "2:00pm-3:00pm",
          "instructor": "Adryan",
          "spots_remaining": 0,
          "is_full": true,
          "is_past": true,
          "raw_text": "12/19/25, 2:00-3:00pm, Adryan\n\t\t\t\t\t\t\t\t\t -- 0 remaining"
        },
        {
          "date": "2025-12-22",
          "date_display": "12/22/2025",
          "time_start": "11:00",
          "time_end": "12:00",
          "time_display": "11:00am-12:00pm",
          "instructor": "Adryan",
          "spots_remaining": 0,
          "is_full": true,
          "is_past": true,
          "raw_text": "12/22/25, 11:00-12:00pm, Adryan\n\t\t\t\t\t\t\t\t\t -- 0 remaining"
        },
        {
          "date": "2025-12-23",
          "date_display": "12/23/2025",
          "time_start": "09:30",
          "time_end": "10:30",
          "time_display": "9:30am-10:30am",
          "instructor": "Adryan",
          "spots_remaining": 0,
          "is_full": true,
          "is_past": true,
          "raw_text": "12/23/25, 9:30-10:30am, Adryan\n\t\t\t\t\t\t\t\t\t -- 0 remaining"
        },
        {
          "date": "2025-12-23",
          "date_display": "12/23/2025",
          "time_start": "12:30",
          "time_end": "13:30",
          "time_display": "12:30pm-1:30pm",
          "instructor": "Adryan",
          "spots_remaining": 0,
          "is_full": true,
          "is_past": true,
          "raw_text": "12/23/25, 12:30-1:30pm; Adryan\n\t\t\t\t\t\t\t\t\t -- 0 remaining"
        },
        {
          "date": "2025-12-29",
          "date_display": "12/29/2025",
          "time_start": "10:30",
          "time_end": "11:30",
          "time_display": "10:30am-11:30am",
          "instructor": "Adryan",
          "spots_remaining": 0,
          "is_full": true,
          "is_past": true,
          "raw_text": "12/29/25, 10:30-11:30am, Adryan\n\t\t\t\t\t\t\t\t\t -- 0 remaining"
        },
        {
          "date": "2025-12-29",
          "date_display": "12/29/2025",
          "time_start": "13:00",
          "time_end": "14:00",
          "time_display": "1:00pm-2:00pm",
          "instructor": "Adryan",
          "spots_remaining": 0,
          "is_full": true,
          "is_past": true,
          "raw_text": "12/29/25, 1:00-2:00pm, Adryan\n\t\t\t\t\t\t\t\t\t -- 0 remaining"
        },
        {
          "date": "2025-12-30",
          "date_display": "12/30/2025",
          "time_start": "09:00",
          "time_end": "10:00",
          "time_display": "9:00am-10:00am",
          "instructor": "Adryan",
          "spots_remaining": 0,
          "is_full": true,
          "is_past": true,
          "raw_text": "12/30/25, 9:00-10:00am, Adryan\n\t\t\t\t\t\t\t\t\t -- 0 remaining"
        },
        {
          "date": "2025-12-31",
          "date_display": "12/31/2025",
          "time_start": "09:30",
          "time_end": "10:30",
          "time_display": "9:30am-10:30am",
          "instructor": "Adryan",
          "spots_remaining": 0,
          "is_full": true,
          "is_past": true,
          "raw_text": "12/31/25, 9:30-10:30am, Adryan\n\t\t\t\t\t\t\t\t\t -- 0 remaining"
        },
        {
          "date": "2025-12-31",
          "date_display": "12/31/2025",
          "time_start": "11:00",
          "time_end": "12:00",
          "time_display": "11:00am-12:00pm",
          "instructor": "Adryan",
          "spots_remaining": 0,
          "is_full": true,
          "is_past": true,
          "raw_text": "12/31/25, 11:00-12:00pm, Adryan\n\t\t\t\t\t\t\t\t\t -- 0 remaining"
        },
        {
          "date": "2026-01-05",
          "date_display": "01/05/2026",
          "time_start": "09:30",
          "time_end": "10:30",
          "time_display": "9:30am-10:30am",
          "instructor": "Adryan",
          "spots_remaining": 0,
          "is_full": true,
          "is_past": true,
          "raw_text": "01/05/26, 9:30-10:30am, Adryan\n\t\t\t\t\t\t\t\t\t -- 0 remaining"
        },
        {
          "date": "2026-01-06",
          "date_display": "01/06/2026",
          "time_start": "13:00",
          "time_end": "14:00",
          "time_display": "1:00pm-2:00pm",
          "instructor": "Alex",
          "spots_remaining": 0,
          "is_full": true,
          "is_past": false,
          "raw_text": "01/06/26, 1:00-2:00pm; Alex\n\t\t\t\t\t\t\t\t\t -- 0 remaining"
        },
        {
          "date": "2026-01-06",
          "date_display": "01/06/2026",
          "time_start": "14:30",
          "time_end": "15:30",
          "time_display": "2:30pm-3:30pm",
          "instructor": "Alex",
          "spots_remaining": 0,
          "is_full": true,
          "is_past": false,
          "raw_text": "01/06/26, 2:30-3:30pm; Alex\n\t\t\t\t\t\t\t\t\t -- 0 remaining"
        },
        {
          "date": "2026-01-08",
          "date_display": "01/08/2026",
          "time_start": "11:00",
          "time_end": "12:00",
          "time_display": "11:00am-12:00pm",
          "instructor": "Adryan",
          "spots_remaining": 0,
          "is_full": true,
          "is_past": false,
          "raw_text": "01/08/26, 11:00am-12:00pm, Adryan\n\t\t\t\t\t\t\t\t\t -- 0 remaining"
        },
        {
          "date": "2026-01-12",
          "date_display": "01/12/2026",
          "time_start": "15:00",
          "time_end": "16:00",
          "time_display": "3:00pm-4:00pm",
          "instructor": "Alex",
          "spots_remaining": 0,
          "is_full": true,
          "is_past": false,
          "raw_text": "01/12/26, 3:00-4:00pm; Alex\n\t\t\t\t\t\t\t\t\t -- 0 remaining"
        },
        {
          "date": "2025-01-14",
          "date_display": "01/14/2025",
          "time_start": "09:00",
          "time_end": "10:00",
          "time_display": "9:00am-10:00am",
          "instructor": "Alex",
          "spots_remaining": 0,
          "is_full": true,
          "is_past": true,
          "raw_text": "01/14/25, 9:00-10:00am; Alex\n\t\t\t\t\t\t\t\t\t -- 0 remaining"
        },
        {
          "date": "2026-01-14",
          "date_display": "01/14/2026",
          "time_start": "11:00",
          "time_end": "12:00",
          "time_display": "11:00am-12:00pm",
          "instructor": "Alex",
          "spots_remaining": 0,
          "is_full": true,
          "is_past": false,
          "raw_text": "01/14/26, 11:00-12:00pm; Alex\n\t\t\t\t\t\t\t\t\t -- 0 remaining"
        },
        {
          "date": "2026-01-16",
          "date_display": "01/16/2026",
          "time_start": "14:30",
          "time_end": "15:30",
          "time_display": "2:30pm-3:30pm",
          "instructor": "Alex",
          "spots_remaining": 0,
          "is_full": true,
          "is_past": false,
          "raw_text": "01/16/26, 2:30-3:30pm; Alex\n\t\t\t\t\t\t\t\t\t -- 0 remaining"
        },
        {
          "date": "2026-01-20",
          "date_display": "01/20/2026",
          "time_start": "14:00",
          "time_end": "15:00",
          "time_display": "2:00pm-3:00pm",
          "instructor": "Alex",
          "spots_remaining": 0,
          "is_full": true,
          "is_past": false,
          "raw_text": "01/20/26, 2:00-3:00pm; Alex\n\t\t\t\t\t\t\t\t\t -- 0 remaining"
        },
        {
          "date": "2026-01-21",
          "date_display": "01/21/2026",
          "time_start": "10:00",
          "time_end": "11:00",
          "time_display": "10:00am-11:00am",
          "instructor": "Alex",
          "spots_remaining": 0,
          "is_full": true,
          "is_past": false,
          "raw_text": "01/21/26, 10:00-11:00am; Alex\n\t\t\t\t\t\t\t\t\t -- 0 remaining"
        },
        {
          "date": "2026-01-22",
          "date_display": "01/22/2026",
          "time_start": "10:00",
          "time_end": "11:00",
          "time_display": "10:00am-11:00am",
          "instructor": "Adryan",
          "spots_remaining": 1,
          "is_full": false,
          "is_past": false,
          "raw_text": "01/22/26, 10:00-11:00am, Adryan\n\t\t\t\t\t\t\t\t\t -- 1 remaining"
        },
        {
          "date": "2026-01-26",
          "date_display": "01/26/2026",
          "time_start": "13:00",
          "time_end": "14:00",
          "time_display": "1:00pm-2:00pm",
          "instructor": "Adryan",
          "spots_remaining": 1,
          "is_full": false,
          "is_past": false,
          "raw_text": "01/26/26, 1:00-2:00pm, Adryan\n\t\t\t\t\t\t\t\t\t -- 1 remaining"
        },
        {
          "date": "2026-01-27",
          "date_display": "01/27/2026",
          "time_start": "14:00",
          "time_end": "15:00",
          "time_display": "2:00pm-3:00pm",
          "instructor": "Adryan",
          "spots_remaining": 1,
          "is_full": false,
          "is_past": false,
          "raw_text": "01/27/26, 2:00-3:00pm, Adryan\n\t\t\t\t\t\t\t\t\t -- 1 remaining"
        },
        {
          "date": "2026-01-28",
          "date_display": "01/28/2026",
          "time_start": "09:30",
          "time_end": "10:30",
          "time_display": "9:30am-10:30am",
          "instructor": "Adryan",
          "spots_remaining": 1,
          "is_full": false,
          "is_past": false,
          "raw_text": "01/28/26, 9:30-10:30am, Adryan\n\t\t\t\t\t\t\t\t\t -- 1 remaining"
        }
      ],
      "last_updated": "2026-01-05T09:22:22.872763"
    },
    {
      "class_name": "Financial Empowerment Training",
      "location": "GCC",
      "location_full": "Goodwill Community Center (North Austin)",
      "form_url": "https://gwcareeradvancement.wufoo.com/forms/gcc-11-financial-empowerment-trainings/",
      "sessions": [
        {
          "date": null,
          "date_display": "Select from Dropdown\n\t\t\t\t\t\t\t\t\t -- 0 remaining",
          "time_start": null,
          "time_end": null,
          "time_display": null,
          "instructor": null,
          "spots_remaining": 0,
          "is_full": true,
          "is_past": false,
          "raw_text": "Select from Dropdown\n\t\t\t\t\t\t\t\t\t -- 0 remaining"
        },
        {
          "date": "2025-12-18",
          "date_display": "12/18/2025",
          "time_start": "15:00",
          "time_end": "16:00",
          "time_display": "3:00PM-4:00PM",
          "instructor": "Doug",
          "spots_remaining": 0,
          "is_full": true,
          "is_past": true,
          "raw_text": "12/18/25, 3:00-4:00 PM; Doug\n\t\t\t\t\t\t\t\t\t -- 0 remaining"
        },
        {
          "date": "2025-12-22",
          "date_display": "12/22/2025",
          "time_start": "09:00",
          "time_end": "10:00",
          "time_display": "9:00AM-10:00AM",
          "instructor": "Doug",
          "spots_remaining": 0,
          "is_full": true,
          "is_past": true,
          "raw_text": "12/22/25, 9:00-10:00 AM; Doug\n\t\t\t\t\t\t\t\t\t -- 0 remaining"
        },
        {
          "date": "2026-01-05",
          "date_display": "01/05/2026",
          "time_start": "11:30",
          "time_end": "12:30",
          "time_display": "11:30am-12:30pm",
          "instructor": "Doug",
          "spots_remaining": 0,
          "is_full": true,
          "is_past": true,
          "raw_text": "01/05/2026, 11:30-12:30pm, Doug\n\t\t\t\t\t\t\t\t\t -- 0 remaining"
        },
        {
          "date": "2026-01-05",
          "date_display": "01/05/2026",
          "time_start": "13:30",
          "time_end": "14:30",
          "time_display": "1:30pm-2:30pm",
          "instructor": "Doug",
          "spots_remaining": 0,
          "is_full": true,
          "is_past": true,
          "raw_text": "01/05/2026, 1:30-2:30pm, Doug\n\t\t\t\t\t\t\t\t\t -- 0 remaining"
        },
        {
          "date": "2026-01-05",
          "date_display": "01/05/2026",
          "time_start": "14:30",
          "time_end": "15:30",
          "time_display": "2:30pm-3:30pm",
          "instructor": "Doug",
          "spots_remaining": 1,
          "is_full": false,
          "is_past": true,
          "raw_text": "01/05/2026, 2:30-3:30pm, Doug\n\t\t\t\t\t\t\t\t\t -- 1 remaining"
        },
        {
          "date": "2026-01-06",
          "date_display": "01/06/2026",
          "time_start": "11:30",
          "time_end": "12:30",
          "time_display": "11:30am-12:30pm",
          "instructor": "Doug",
          "spots_remaining": 1,
          "is_full": false,
          "is_past": false,
          "raw_text": "01/06/2026, 11:30-12:30pm, Doug\n\t\t\t\t\t\t\t\t\t -- 1 remaining"
        },
        {
          "date": "2026-01-06",
          "date_display": "01/06/2026",
          "time_start": "15:00",
          "time_end": "16:00",
          "time_display": "3:00pm-4:00pm",
          "instructor": "Doug",
          "spots_remaining": 1,
          "is_full": false,
          "is_past": false,
          "raw_text": "01/06/2026, 3:00-4:00pm, Doug\n\t\t\t\t\t\t\t\t\t -- 1 remaining"
        },
        {
          "date": "2026-01-07",
          "date_display": "01/07/2026",
          "time_start": "10:30",
          "time_end": "11:30",
          "time_display": "10:30am-11:30am",
          "instructor": "Doug",
          "spots_remaining": 1,
          "is_full": false,
          "is_past": false,
          "raw_text": "01/07/2026, 10:30-11:30am, Doug\n\t\t\t\t\t\t\t\t\t -- 1 remaining"
        },
        {
          "date": "2026-01-08",
          "date_display": "01/08/2026",
          "time_start": "09:00",
          "time_end": "10:00",
          "time_display": "9:00am-10:00am",
          "instructor": "Doug",
          "spots_remaining": 0,
          "is_full": true,
          "is_past": false,
          "raw_text": "01/08/2026, 9:00-10:00am, Doug\n\t\t\t\t\t\t\t\t\t -- 0 remaining"
        },
        {
          "date": "2026-01-12",
          "date_display": "01/12/2026",
          "time_start": "09:00",
          "time_end": "10:00",
          "time_display": "9:00am-10:00am",
          "instructor": "Doug",
          "spots_remaining": 0,
          "is_full": true,
          "is_past": false,
          "raw_text": "01/12/2026, 9:00-10:00am, Doug\n\t\t\t\t\t\t\t\t\t -- 0 remaining"
        },
        {
          "date": "2026-01-12",
          "date_display": "01/12/2026",
          "time_start": "13:00",
          "time_end": "14:00",
          "time_display": "1:00pm-2:00pm",
          "instructor": "Doug",
          "spots_remaining": 0,
          "is_full": true,
          "is_past": false,
          "raw_text": "01/12/2026, 1:00-2:00pm, Doug\n\t\t\t\t\t\t\t\t\t -- 0 remaining"
        },
        {
          "date": "2026-01-12",
          "date_display": "01/12/2026",
          "time_start": "14:30",
          "time_end": "15:30",
          "time_display": "2:30pm-3:30pm",
          "instructor": "Doug",
          "spots_remaining": 0,
          "is_full": true,
          "is_past": false,
          "raw_text": "01/12/2026, 2:30-3:30pm, Doug\n\t\t\t\t\t\t\t\t\t -- 0 remaining"
        },
        {
          "date": "2026-01-13",
          "date_display": "01/13/2026",
          "time_start": null,
          "time_end": null,
          "time_display": null,
          "instructor": "Doug",
          "spots_remaining": 1,
          "is_full": false,
          "is_past": false,
          "raw_text": "01/13/2026, 11:00-Noon, Doug\n\t\t\t\t\t\t\t\t\t -- 1 remaining"
        },
        {
          "date": "2026-01-13",
          "date_display": "01/13/2026",
          "time_start": "13:00",
          "time_end": "14:00",
          "time_display": "1:00pm-2:00pm",
          "instructor": "Doug",
          "spots_remaining": 1,
          "is_full": false,
          "is_past": false,
          "raw_text": "01/13/2026, 1:00-2:00pm, Doug\n\t\t\t\t\t\t\t\t\t -- 1 remaining"
        },
        {
          "date": "2026-01-14",
          "date_display": "01/14/2026",
          "time_start": null,
          "time_end": null,
          "time_display": null,
          "instructor": "Doug",
          "spots_remaining": 1,
          "is_full": false,
          "is_past": false,
          "raw_text": "01/14/2026, 11:00-Noon, Doug\n\t\t\t\t\t\t\t\t\t -- 1 remaining"
        },
        {
          "date": "2026-01-15",
          "date_display": "01/15/2026",
          "time_start": "09:00",
          "time_end": "10:00",
          "time_display": "9:00am-10:00am",
          "instructor": "Doug",
          "spots_remaining": 1,
          "is_full": false,
          "is_past": false,
          "raw_text": "01/15/2026, 9:00-10:00am, Doug\n\t\t\t\t\t\t\t\t\t -- 1 remaining"
        },
        {
          "date": "2026-01-20",
          "date_display": "01/20/2026",
          "time_start": null,
          "time_end": null,
          "time_display": null,
          "instructor": "Doug",
          "spots_remaining": 1,
          "is_full": false,
          "is_past": false,
          "raw_text": "01/20/2026, 11:00-Noon, Doug\n\t\t\t\t\t\t\t\t\t -- 1 remaining"
        },
        {
          "date": "2026-01-20",
          "date_display": "01/20/2026",
          "time_start": "15:00",
          "time_end": "16:00",
          "time_display": "3:00pm-4:00pm",
          "instructor": "Doug",
          "spots_remaining": 1,
          "is_full": false,
          "is_past": false,
          "raw_text": "01/20/2026, 3:00-4:00pm, Doug\n\t\t\t\t\t\t\t\t\t -- 1 remaining"
        },
        {
          "date": "2026-01-21",
          "date_display": "01/21/2026",
          "time_start": "15:30",
          "time_end": "16:30",
          "time_display": "3:30pm-4:30pm",
          "instructor": "Doug",
          "spots_remaining": 1,
          "is_full": false,
          "is_past": false,
          "raw_text": "01/21/2026, 3:30-4:30pm, Doug\n\t\t\t\t\t\t\t\t\t -- 1 remaining"
        },
        {
          "date": "2026-01-22",
          "date_display": "01/22/2026",
          "time_start": "09:00",
          "time_end": "10:00",
          "time_display": "9:00am-10:00am",
          "instructor": "Doug",
          "spots_remaining": 1,
          "is_full": false,
          "is_past": false,
          "raw_text": "01/22/2026, 9:00-10:00am, Doug\n\t\t\t\t\t\t\t\t\t -- 1 remaining"
        },
        {
          "date": "2026-01-22",
          "date_display": "01/22/2026",
          "time_start": "15:00",
          "time_end": "16:00",
          "time_display": "3:00pm-4:00pm",
          "instructor": "Doug",
          "spots_remaining": 1,
          "is_full": false,
          "is_past": false,
          "raw_text": "01/22/2026, 3:00-4:00pm, Doug\n\t\t\t\t\t\t\t\t\t -- 1 remaining"
        },
        {
          "date": "2026-01-26",
          "date_display": "01/26/2026",
          "time_start": null,
          "time_end": null,
          "time_display": null,
          "instructor": "Doug",
          "spots_remaining": 1,
          "is_full": false,
          "is_past": false,
          "raw_text": "01/26/2026, 11:00-Noon, Doug\n\t\t\t\t\t\t\t\t\t -- 1 remaining"
        },
        {
          "date": "2026-01-27",
          "date_display": "01/27/2026",
          "time_start": "09:00",
          "time_end": "10:00",
          "time_display": "9:00am-10:00am",
          "instructor": "Doug",
          "spots_remaining": 1,
          "is_full": false,
          "is_past": false,
          "raw_text": "01/27/2026, 9:00-10:00am, Doug\n\t\t\t\t\t\t\t\t\t -- 1 remaining"
        },
        {
          "date": "2026-01-27",
          "date_display": "01/27/2026",
          "time_start": "10:30",
          "time_end": "11:30",
          "time_display": "10:30am-11:30am",
          "instructor": "Doug",
          "spots_remaining": 1,
          "is_full": false,
          "is_past": false,
          "raw_text": "01/27/2026, 10:30-11:30am, Doug\n\t\t\t\t\t\t\t\t\t -- 1 remaining"
        },
        {
          "date": "2026-01-27",
          "date_display": "01/27/2026",
          "time_start": "15:00",
          "time_end": "16:00",
          "time_display": "3:00pm-4:00pm",
          "instructor": "Doug",
          "spots_remaining": 1,
          "is_full": false,
          "is_past": false,
          "raw_text": "01/27/2026, 3:00-4:00pm, Doug\n\t\t\t\t\t\t\t\t\t -- 1 remaining"
        },
        {
          "date": "2026-01-28",
          "date_display": "01/28/2026",
          "time_start": "09:00",
          "time_end": "10:00",
          "time_display": "9:00am-10:00am",
          "instructor": "Doug",
          "spots_remaining": 1,
          "is_full": false,
          "is_past": false,
          "raw_text": "01/28/2026, 9:00-10:00am, Doug\n\t\t\t\t\t\t\t\t\t -- 1 remaining"
        },
        {
          "date": "2026-01-28",
          "date_display": "01/28/2026",
          "time_start": "13:00",
          "time_end": "14:00",
          "time_display": "1:00pm-2:00pm",
          "instructor": "Doug",
          "spots_remaining": 1,
          "is_full": false,
          "is_past": false,
          "raw_text": "01/28/2026, 1:00-2:00pm, Doug\n\t\t\t\t\t\t\t\t\t -- 1 remaining"
        },
        {
          "date": "2026-01-29",
          "date_display": "01/29/2026",
          "time_start": "12:30",
          "time_end": "13:30",
          "time_display": "12:30pm-1:30pm",
          "instructor": "Doug",
          "spots_remaining": 1,
          "is_full": false,
          "is_past": false,
          "raw_text": "01/29/2026, 12:30-1:30pm, Doug\n\t\t\t\t\t\t\t\t\t -- 1 remaining"
        },
        {
          "date": "2026-01-29",
          "date_display": "01/29/2026",
          "time_start": "15:00",
          "time_end": "16:00",
          "time_display": "3:00pm-4:00pm",
          "instructor": "Doug",
          "spots_remaining": 1,
          "is_full": false,
          "is_past": false,
          "raw_text": "01/29/2026, 3:00-4:00pm, Doug\n\t\t\t\t\t\t\t\t\t -- 1 remaining"
        },
        {
          "date": "2026-01-30",
          "date_display": "01/30/2026",
          "time_start": "11:30",
          "time_end": "12:30",
          "time_display": "11:30am-12:30pm",
          "instructor": "Doug",
          "spots_remaining": 1,
          "is_full": false,
          "is_past": false,
          "raw_text": "01/30/2026, 11:30-12:30pm, Doug\n\t\t\t\t\t\t\t\t\t -- 1 remaining"
        },
        {
          "date": "2026-01-30",
          "date_display": "01/30/2026",
          "time_start": "13:00",
          "time_end": "14:00",
          "time_display": "1:00pm-2:00pm",
          "instructor": "Doug",
          "spots_remaining": 1,
          "is_full": false,
          "is_past": false,
          "raw_text": "01/30/2026, 1:00-2:00pm, Doug\n\t\t\t\t\t\t\t\t\t -- 1 remaining"
        }
      ],
      "last_updated": "2026-01-05T09:22:26.272777"
    },
    {
      "class_name": "Indeed Lab",
      "location": "GCC",
      "location_full": "Goodwill Community Center (North Austin)",
      "form_url": "https://gwcareeradvancement.wufoo.com/forms/gcc-indeed-lab/",
      "sessions": [
        {
          "date": null,
          "date_display": "Select from Dropdown\n\t\t\t\t\t\t\t\t\t -- 0 remaining",
          "time_start": null,
          "time_end": null,
          "time_display": null,
          "instructor": null,
          "spots_remaining": 0,
          "is_full": true,
          "is_past": false,
          "raw_text": "Select from Dropdown\n\t\t\t\t\t\t\t\t\t -- 0 remaining"
        },
        {
          "date": "2025-12-18",
          "date_display": "12/18/2025",
          "time_start": "10:00",
          "time_end": "12:00",
          "time_display": "10:00am-12:00pm",
          "instructor": "Alex",
          "spots_remaining": 4,
          "is_full": false,
          "is_past": true,
          "raw_text": "12/18/25, 10:00-12:00pm; Alex\n\t\t\t\t\t\t\t\t\t -- 4 remaining"
        },
        {
          "date": "2025-12-22",
          "date_display": "12/22/2025",
          "time_start": "09:00",
          "time_end": "11:00",
          "time_display": "9:00am-11:00am",
          "instructor": "Alex",
          "spots_remaining": 0,
          "is_full": true,
          "is_past": true,
          "raw_text": "12/22/25, 9:00-11:00am; Alex\n\t\t\t\t\t\t\t\t\t -- 0 remaining"
        },
        {
          "date": "2025-12-23",
          "date_display": "12/23/2025",
          "time_start": "09:00",
          "time_end": "11:00",
          "time_display": "9:00am-11:00am",
          "instructor": "Alex",
          "spots_remaining": 0,
          "is_full": true,
          "is_past": true,
          "raw_text": "12/23/25, 9:00-11:00am; Alex\n\t\t\t\t\t\t\t\t\t -- 0 remaining"
        },
        {
          "date": "2025-12-29",
          "date_display": "12/29/2025",
          "time_start": "23:30",
          "time_end": "13:30",
          "time_display": "11:30pm-1:30pm",
          "instructor": "Alex",
          "spots_remaining": 0,
          "is_full": true,
          "is_past": true,
          "raw_text": "12/29/25, 11:30-1:30pm; Alex\n\t\t\t\t\t\t\t\t\t -- 0 remaining"
        },
        {
          "date": "2025-12-30",
          "date_display": "12/30/2025",
          "time_start": "09:00",
          "time_end": "11:00",
          "time_display": "9:00am-11:00am",
          "instructor": "Alex",
          "spots_remaining": 0,
          "is_full": true,
          "is_past": true,
          "raw_text": "12/30/25, 9:00-11:00am; Alex\n\t\t\t\t\t\t\t\t\t -- 0 remaining"
        },
        {
          "date": "2025-12-03",
          "date_display": "12/03/2025",
          "time_start": "23:00",
          "time_end": "13:00",
          "time_display": "11:00pm-1:00pm",
          "instructor": "Adryan",
          "spots_remaining": 4,
          "is_full": false,
          "is_past": true,
          "raw_text": "12/3/25, 11:00-1:00pm; Adryan\n\t\t\t\t\t\t\t\t\t -- 4 remaining"
        },
        {
          "date": "2025-12-16",
          "date_display": "12/16/2025",
          "time_start": "23:00",
          "time_end": "13:00",
          "time_display": "11:00pm-1:00pm",
          "instructor": "Adryan",
          "spots_remaining": 0,
          "is_full": true,
          "is_past": true,
          "raw_text": "12/16/25, 11:00-1:00pm; Adryan\n\t\t\t\t\t\t\t\t\t -- 0 remaining"
        },
        {
          "date": "2025-12-19",
          "date_display": "12/19/2025",
          "time_start": "23:00",
          "time_end": "13:00",
          "time_display": "11:00pm-1:00pm",
          "instructor": "Adryan",
          "spots_remaining": 0,
          "is_full": true,
          "is_past": true,
          "raw_text": "12/19/25, 11:00-1:00pm; Adryan\n\t\t\t\t\t\t\t\t\t -- 0 remaining"
        },
        {
          "date": "2026-01-05",
          "date_display": "01/05/2026",
          "time_start": "13:00",
          "time_end": "15:00",
          "time_display": "1:00pm-3:00pm",
          "instructor": "Alex",
          "spots_remaining": 0,
          "is_full": true,
          "is_past": true,
          "raw_text": "01/05/26, 1:00-3:00pm; Alex\n\t\t\t\t\t\t\t\t\t -- 0 remaining"
        },
        {
          "date": "2026-01-07",
          "date_display": "01/07/2026",
          "time_start": "10:00",
          "time_end": "12:00",
          "time_display": "10:00am-12:00pm",
          "instructor": "Adryan",
          "spots_remaining": 0,
          "is_full": true,
          "is_past": false,
          "raw_text": "01/07/26, 10:00am-12:00pm; Adryan\n\t\t\t\t\t\t\t\t\t -- 0 remaining"
        },
        {
          "date": "2025-01-08",
          "date_display": "01/08/2025",
          "time_start": "13:00",
          "time_end": "15:00",
          "time_display": "1:00pm-3:00pm",
          "instructor": "Alex",
          "spots_remaining": 3,
          "is_full": false,
          "is_past": true,
